NCT Number,Study Title,Study URL,Study Results,Conditions,Interventions,Sex,Age,Phases,Locations
NCT05285059,Implicit Learning in Epileptic Children,https://clinicaltrials.gov/study/NCT05285059,NO,Epilepsy,BEHAVIORAL: ASRT task,ALL,CHILD,,"Agathe Marcastel, PhD, Bron, 69675, France|Dezso Nemeth, Bron, 69675, France|Service d'Epileptologie Clinique, des Troubles du sommeil et de Neurologie fonctionnelle de l'enfant, à Hôpital Femme Mère et Enfant,, Bron, France"
NCT03013348,Automated Identification of Psychogenic Nonepileptic Seizures,https://clinicaltrials.gov/study/NCT03013348,NO,"Convulsion, Non-Epileptic",DEVICE: Brain Sentinel's sEMG Post-processing algorithm,ALL,"CHILD, ADULT, OLDER_ADULT",,
NCT04158531,REC2Stim as a Treatment for Refractory Epilepsy in the Primary Sensorimotor Cortex.,https://clinicaltrials.gov/study/NCT04158531,NO,Epileptic Seizure|Epilepsy Intractable|Motor Seizure,DEVICE: ECoG sensing and stimulation,ALL,"CHILD, ADULT, OLDER_ADULT",NA,"University Medical Center Utrecht, Utrecht, 3584 CX, Netherlands"
NCT04607317,Exercise as Adjunctive Treatment for Refractory Epilepsy,https://clinicaltrials.gov/study/NCT04607317,NO,Refractory Epilepsy|Epilepsy,BEHAVIORAL: Exercise program|BEHAVIORAL: Health Coach|BEHAVIORAL: Health Information,ALL,"ADULT, OLDER_ADULT",NA,"Wake Forest University Health Sciences, Winston-Salem, North Carolina, 27157, United States"
NCT00282854,Genetics of Rolandic Epilepsy,https://clinicaltrials.gov/study/NCT00282854,NO,Epilepsy,,ALL,"CHILD, ADULT, OLDER_ADULT",,"Mailman School of Public Health, Columbia University Medical Center, 722 West 168th St, 6th Floor, New York, New York, 10032, United States"
NCT00236730,A Study of the Efficacy and Safety of Topiramate in the Treatment of Patients With Difficult to Control Epilepsy,https://clinicaltrials.gov/study/NCT00236730,NO,"Epilepsy|Epilepsies, Partial|Seizures",DRUG: topiramate,ALL,"ADULT, OLDER_ADULT",PHASE2,
NCT05776745,Study of Speech Function in Epileptic Patients Based on Stereoelectroencephalography Signal,https://clinicaltrials.gov/study/NCT05776745,NO,Epilepsy,BEHAVIORAL: Speech|DEVICE: Stereoelectroencephalography,ALL,"CHILD, ADULT",NA,"Zhejiang University School of Medicine Second Affiliated Hospital, Hangzhou, Zhejiang, 310009, China"
NCT02682927,A Trial of Two Fixed Doses of ZX008 (Fenfluramine HCl) in Children and Young Adults With Dravet Syndrome,https://clinicaltrials.gov/study/NCT02682927,YES,Dravet Syndrome|Seizure Disorder,DRUG: ZX008 (Fenfluramine Hydrochloride)|DRUG: Matching Placebo,ALL,"CHILD, ADULT",PHASE3,"Phoenix Children's, Phoenix, Arizona, 85016, United States|Center for Neurosciences - Tucson, Tucson, Arizona, 85718, United States|Rady Children's Hospital San Diego, San Diego, California, 92123, United States|University of California San Francisco, San Francisco, California, 94143, United States|The Children's Hospital Colorado, Aurora, Colorado, 80045, United States|NW FL Clinical Research Group, LLC, Gulf Breeze, Florida, 32561, United States|Miami Children's Hospital Brain Institute, Miami, Florida, 33155, United States|Neurology and Epilepsy Research Center, Orlando, Florida, 32819, United States|Panda Neurology, Atlanta, Georgia, 30328, United States|Children's Hospital of Chicago, Chicago, Illinois, 60611, United States|Massachusetts General Hospital, Boston, Massachusetts, 02114, United States|Boston Children's Hospital, Boston, Massachusetts, 02467, United States|Mayo Clinic, Rochester, Minnesota, 55905, United States|Saint Barnabas Medical Center, Livingston, New Jersey, 07039, United States|Children's Hospital of Philadelphia, Philadelphia, Pennsylvania, 19104, United States|Cook Children's Medical Center, Fort Worth, Texas, 76087, United States|University of Utah, Salt Lake City, Utah, 84113, United States|Seattle Children's Hospital, Seattle, Washington, 98105, United States|MultiCare Institute for Research & Innovation, Tacoma, Washington, 98405, United States|Melbourne Brain Centre Austin Hospital, Melbourne, Australia|Children's Health Queensland Hospital and Health Service at Lady Cilento Children's Hospital, South Brisbane, Australia|The Children's Hospital Westmead Dept. of Neurology and Neurosurgery, Westmead, Australia|Universitair Ziekenhuis Antwerpen, Antwerp, Belgium|British Columbia Children's Hospital BCCH, Vancouver, British Columbia, V6H3V4, Canada|Centre Hospitalier Universitaire Sainte-Justine, Montréal, H3T 1C5, Canada|Danish National Epilepsy Centre, Dianalund, Denmark|French Ref centre Necker Hospital Paris, Paris, France|Epilepsiezentrum / Neuropädiatrie Hedwig-von-Rittberg-Zentrum Für Kinder und Jugendliche, Berlin, Germany|Krankenhaus Mara Epilepsie-Zentrum Bethel, Bielefeld, Germany|Epilepsiezentrum Freiburg, Freiburg, Germany|Universitaetsklinikum Jena Klinik fuer Kinder- und Jugendmedizin Neuropaediatrie, Jena, Germany|Klinik für Neuropädiatrie Universitätsklinikum Schleswig Holstein Campus Kiel, Kiel, Germany|Kleinwachau Saechsisches Epilepsiezentrum Radeberggemeinnuetzige GmbH, Radeberg, Germany|Universitaetsklinik fuer Kinder- und Jugendmedizin Abteilung III, Tübingen, Germany|Schoen Klinik Vogtareuth Neuropaediatrie und Neurologische Rehabilitation, Epilepsiezentrum fuer Kinder und Jugendlische,Tagesklinik fuer Neuropaediatrie, Vogtareuth, Germany|AOU Anna Meyer, Firenze, 50139, Italy|Istituto Pediatrico Giannina Gaslini Dipartimento di Neurologia, Genova, Italy|A.O Carlo Poma, Mantova, 46100, Italy|Instituto Neurologica Carlo Besta, Milano, 20133, Italy|Ospedale Fatebenefratelli e Oftalmico, Milano, Italy|U.O. Neurologia Dipartimento di Neuroscienze Ospedale Pediatrico Bambino Gesù, IRCS, Roma, 00165, Italy|Ospedal Policlinico Giambattista Rossi diBorga Roma, Verona, 37134, Italy|Okayama University Hospital, Okayama-shi, Okayama, Japan|Saitama Children's Medical Center, Saitama-shi, Saitama, Japan|National Epilepsy Center Shizuoka Institute, Shizuoka-city, Shizuoka, Japan|Tokyo Women's Medical University Hospital, Shinjuku-ku, Tokyo, Japan|Hospital Sant Joande Déu, Barcelona, Spain|Hospital Ruber Internacional Primera Planta Servicio de Neurologia, Madrid, Spain|Clinica Universitaria de Navarra Fase 4. Segunda planta, Consulta de Pediatria, Pamplona, Spain|Birmingham Children Hospital, Birmingham, United Kingdom|Institute of Neurosciences Queens Elizabeth University Hospital, Glasgow, United Kingdom|Alder Hey Hospital, Liverpool, United Kingdom|Evelina Hospital, London, United Kingdom|Great Ormonnd Street Hospital for Children NHS Foundation Trust, London, United Kingdom|Sheffield Children's Hospital, Sheffield, United Kingdom"
NCT05015868,"Contribution of Genetics, Non-invasive Methods and Neuropsychology in Focal Cryptogenic Epilepsies",https://clinicaltrials.gov/study/NCT05015868,NO,"Epilepsies, Partial|Epilepsy Intractable",DIAGNOSTIC_TEST: Standard of care|DIAGNOSTIC_TEST: Functional magnetic resonance imaging-Electroencephalogram combined analysis|DIAGNOSTIC_TEST: High density- electroencephalogram or 7 Tesla magnetic resonance imaging,ALL,"CHILD, ADULT",NA,"Scientific Institute IRCCS Eugenio Medea, Bosisio Parini, Lecco, 23842, Italy"
NCT00236691,"A Study of the Efficacy and Safety of Topiramate as add-on Therapy in the Treatment of Epilepsy Patients With Difficult to Treat, Partial-onset Seizures.",https://clinicaltrials.gov/study/NCT00236691,NO,"Epilepsy|Epilepsies, Partial|Seizures",DRUG: topiramate,ALL,"ADULT, OLDER_ADULT",PHASE2,
NCT00236873,"A Study of the Efficacy and Safety of Topiramate as add-on Therapy in the Treatment of Epilepsy Patients With Difficult to Treat, Partial-onset Seizures.",https://clinicaltrials.gov/study/NCT00236873,NO,"Epilepsy|Epilepsies, Partial|Seizures",DRUG: topiramate,ALL,"ADULT, OLDER_ADULT",PHASE2,
NCT00236860,"A Study of the Efficacy and Safety of Topiramate as add-on Therapy in the Treatment of Epilepsy Patients With Difficult to Treat, Partial-onset Seizures",https://clinicaltrials.gov/study/NCT00236860,NO,"Epilepsy|Epilepsies, Partial|Seizures",DRUG: topiramate,ALL,"ADULT, OLDER_ADULT",PHASE2,
NCT05561166,EPIDREAM 1 : Study of Dreaming in Epilepsy,https://clinicaltrials.gov/study/NCT05561166,NO,Epilepsy,OTHER: EPIDREAM Questionnaire,ALL,"ADULT, OLDER_ADULT",,"Hospices Civils de Lyon, Bron, Rhône, 69500, France"
NCT04716673,Stimulation of Sleep in Patients With Epilepsy,https://clinicaltrials.gov/study/NCT04716673,NO,Epilepsy,OTHER: Down-phase targeted auditory stimulation,ALL,"CHILD, ADULT",NA,"University Children's Hospital Zurich, Zurich, 8032, Switzerland"
NCT05269901,Association Between Ferroptosis and Epilepsy,https://clinicaltrials.gov/study/NCT05269901,NO,Epilepsy,"GENETIC: SLC7A11, GPX4, P53",ALL,CHILD,,"Affiliated Hospital of JiangNan University, Department of Pediatrics, Wuxi, Jiangsu, 226600, China"
NCT05671575,Study The Knowledge and Attitude Towards Epilepsy Among Relatives of People With Epilepsy and Their Impact on The Patient's Quality of Life,https://clinicaltrials.gov/study/NCT05671575,NO,Epilepsy,OTHER: Questionnaire about Epilepsy,ALL,"CHILD, ADULT, OLDER_ADULT",,"Sohag university hospital, Sohag, 82611, Egypt"
NCT05450822,Precision Medicine in the Treatment of Epilepsy,https://clinicaltrials.gov/study/NCT05450822,NO,Epilepsy,DRUG: Levetiracetam|DRUG: Levetiracetam Tablets|DRUG: Lamotrigine tablet,ALL,"CHILD, ADULT",,"Neurobiology Research Unit, Rigshospitalet, Copenhagen, 2100, Denmark"
NCT05698537,Risk Factors and Etiologies of Epilepsy in Urban and Rural Rwanda,https://clinicaltrials.gov/study/NCT05698537,NO,Epilepsy,DIAGNOSTIC_TEST: EEG|DIAGNOSTIC_TEST: Neuroimaging|DIAGNOSTIC_TEST: Blood sample|OTHER: Risk factor questionnaire,ALL,"CHILD, ADULT, OLDER_ADULT",,"King Faisal Hospital, Kigali, Rwanda"
NCT04266990,Olfactive Discriminative Ability of Dogs When Confronted With Seizure and Non-seizure Samples // Identification of Potential Biomarkers for Epilepsy in Human Sweat.,https://clinicaltrials.gov/study/NCT04266990,NO,Epilepsy,OTHER: Planned Sweat collection|OTHER: Spontaneous Sweat collection|OTHER: Healthy volunteers sweat collection,ALL,"ADULT, OLDER_ADULT",NA,"UZ Gent, Gent, Belgie, 9000, Belgium"
NCT04526418,Evaluation of the 24/7 EEG SubQ System for Ultra Long-Term Recording of Patients With Temporal Lobe Epilepsy,https://clinicaltrials.gov/study/NCT04526418,NO,Epilepsy,DEVICE: 24/7 EEG™ SubQ system,ALL,"ADULT, OLDER_ADULT",NA,"Mayo Clinic, Phoenix, Arizona, 85054, United States|University of California, Los Angeles, California, 90095, United States|Massachusetts General Hospital, Boston, Massachusetts, 02114, United States|University of Pennsylvenia, Philadelphia, Pennsylvania, 19104, United States|Universität Klinikum Freibrug, Freiburg, 79106, Germany|Walton Centre NHS Foundation Trust, Fazakerley, Liverpool, L9 7LJ, United Kingdom"
NCT04705441,Self-management for People With Epilepsy,https://clinicaltrials.gov/study/NCT04705441,NO,Epilepsy,BEHAVIORAL: SMART 2,ALL,"ADULT, OLDER_ADULT",NA,"University of Iowa, Iowa City, Iowa, 52242, United States|Case Western Reserve University, Cleveland, Ohio, 44106, United States"
NCT03582345,Investigation of Human Epileptic Networks by fMRI,https://clinicaltrials.gov/study/NCT03582345,NO,Epilepsy,PROCEDURE: EEG/fMRI,ALL,"ADULT, OLDER_ADULT",NA,
NCT05934786,Rehabilitation of Cognition and Psychosocial Well-being in Epilepsy,https://clinicaltrials.gov/study/NCT05934786,NO,Epilepsy,BEHAVIORAL: Cognitive rehabilitation,ALL,"ADULT, OLDER_ADULT",NA,
NCT05082181,Telephone-Based Support Programs for People With Epilepsy,https://clinicaltrials.gov/study/NCT05082181,NO,Epilepsy,BEHAVIORAL: UPLIFT (Using Practice and Learning to Increase Favorable Thoughts)|BEHAVIORAL: BOOST (Bringing Out Our Strength Together),ALL,"ADULT, OLDER_ADULT",NA,"NYU Langone Health, New York, New York, 10016, United States"
NCT05683847,User Controlled Follow-up of Epilepsy,https://clinicaltrials.gov/study/NCT05683847,NO,Epilepsy,OTHER: User controlled epilepsy follow-up by means of patient reported outcome measures (PROM),ALL,"ADULT, OLDER_ADULT",,"Drammen Hospital, Drammen, 3004, Norway"
NCT05384782,Computational Decision Support in Epilepsy Using Retrospective EEG,https://clinicaltrials.gov/study/NCT05384782,NO,Epilepsy,,ALL,"ADULT, OLDER_ADULT",,"Cornwall Partnership NHS Foundation Trust, Bodmin, Cornwall, PL31 2QN, United Kingdom"
NCT00236847,A Study of the Efficacy and Safety of Topiramate in the Treatment of Patients With Epilepsy.,https://clinicaltrials.gov/study/NCT00236847,NO,"Epilepsy|Epilepsies, Partial|Seizures",DRUG: topiramate,ALL,"ADULT, OLDER_ADULT",PHASE2,
NCT05898438,The Role of Gut Microbiota in Children With Epilepsy Following Ketogenic Diet,https://clinicaltrials.gov/study/NCT05898438,NO,Epilepsy,,ALL,"CHILD, ADULT",,"Attikon Athens University Hospital, Athens, Haidari, 12462, Greece"
NCT06139198,Self-management Intervention for Reducing Epilepsy Burden Among Ugandans With Epilepsy.,https://clinicaltrials.gov/study/NCT06139198,NO,Epilepsy,BEHAVIORAL: Self-MAnagement intervention for Reducing The epilepsy burden among Ugandans,ALL,"ADULT, OLDER_ADULT",NA,
NCT06052605,Healthy Aging in People With Epilepsy Program,https://clinicaltrials.gov/study/NCT06052605,NO,Epilepsy,BEHAVIORAL: Healthy Aging in People with Epilepsy Program,ALL,"ADULT, OLDER_ADULT",NA,"University of Califonia, San Diego, San Diego, California, 92093, United States"
NCT05200455,Microelectrodes in Epilepsy,https://clinicaltrials.gov/study/NCT05200455,YES,Epilepsy,DEVICE: Microelectrodes,ALL,"ADULT, OLDER_ADULT",NA,"Dartmouth-Hitchcock Medical Center, Lebanon, New Hampshire, 03756, United States"
NCT04944641,"Epilepsy Prevalence and Intervention Study in Zhejiang Province, China",https://clinicaltrials.gov/study/NCT04944641,NO,Epilepsy,BEHAVIORAL: education on epilepsy|DRUG: routine and proper antiepileptic drugs,ALL,"CHILD, ADULT, OLDER_ADULT",NA,"2nd Affiliated Hospital, School of Medicine, Zhejiang University, China, Hangzhou, Zhejiang, China|Shengzhou People's Hospital, Shengzhou, China"
NCT01281956,PRX-00023 Therapy in Localization-Related Epilepsy,https://clinicaltrials.gov/study/NCT01281956,YES,"Epilepsy|Epilepsy, Temporal Lobe|Partial Epilepsy",DRUG: PRX-00023|DRUG: Placebo,ALL,"ADULT, OLDER_ADULT",PHASE2,"National Institutes of Health Clinical Center, 9000 Rockville Pike, Bethesda, Maryland, 20892, United States"
NCT06346262,Seizure Rescue Medication (RM) as Part of a Comprehensive Epilepsy Self-management Package of Care,https://clinicaltrials.gov/study/NCT06346262,NO,Epilepsy,BEHAVIORAL: SMART RM|DRUG: Valtoco Nasal Product,ALL,"ADULT, OLDER_ADULT",PHASE4,"University Hospitals Medical Center, Cleveland, Ohio, 44106, United States"
NCT04692701,Pulvinar Stimulation in Epilepsy: a Pilot Study,https://clinicaltrials.gov/study/NCT04692701,NO,Epilepsy,DEVICE: Pulvinar deep brain stimulation,ALL,ADULT,NA,"Service de Neurologie, Nice, 13385, France"
NCT05335187,Hybrid Micro-macro Electrodes in Patients With Epilepsy,https://clinicaltrials.gov/study/NCT05335187,NO,Epilepsy,DEVICE: micro-macro electrode implantation,ALL,"ADULT, OLDER_ADULT",NA,"Hôpitaux Universitaires de Genève, Genève, CH, 1205, Switzerland"
NCT01273129,Surgery as a Treatment for Medically Intractable Epilepsy,https://clinicaltrials.gov/study/NCT01273129,NO,"Epilepsy|Epilepsy, Temporal Lobe|Partial Epilepsy",,ALL,"CHILD, ADULT, OLDER_ADULT",,"National Institutes of Health Clinical Center, Bethesda, Maryland, 20892, United States"
NCT02952456,Phenomenological Approach of Epilepsy in Patients With Epilepsy,https://clinicaltrials.gov/study/NCT02952456,NO,Epilepsy,OTHER: interview with a psychologist,ALL,"CHILD, ADULT, OLDER_ADULT",,"Uhmontpellier, Montpellier, 34295, France"
NCT04559919,Prospective Regional Epilepsy Database,https://clinicaltrials.gov/study/NCT04559919,NO,Epilepsy,OTHER: Seizure status|DIAGNOSTIC_TEST: Tests|OTHER: Epilepsy|OTHER: Demographics and psychosocial|OTHER: Health care,ALL,"ADULT, OLDER_ADULT",,"Södra Älvsborgs Sjukhus, Borås, Sweden|Sahlgrenska University Hospital, Gothenburg, 41345, Sweden|Sjukhusen i Väster, Gothenburg, Sweden"
NCT06082999,Gene-STEPS: Shortening Time of Evaluation in Paediatric Epilepsy Services,https://clinicaltrials.gov/study/NCT06082999,NO,Epilepsy,,ALL,CHILD,,"Boston Children's Hospital, Boston, Massachusetts, 02115, United States|Murdoch Childrens Research Institute, Parkville, Victoria, 3052, Australia|The Hospital for Sick Children, Toronto, Ontario, M5G 1X8, Canada|UCL Great Ormond Street Institute of Child Health, London, WC1N 1DZ, United Kingdom"
NCT00594945,Study of Intranasal Clonazepam in Adult Subjects With Epileptic Seizures,https://clinicaltrials.gov/study/NCT00594945,YES,Epilepsy,DRUG: Clonazepam,ALL,"ADULT, OLDER_ADULT",PHASE2,"Clinical Trials. inc., Little Rock, Arkansas, 72205, United States|Mid-Atlantic Epilepsy & Sleep Center, Bethesda, Maryland, 20817, United States|Columbia Comprehensive Epilepsy Center, Neurological Institute, New York, New York, 10032, United States|Ohio State University, Columbus, Ohio, 43210, United States|Neurological Clinic of Texas, PA, Dallas, Texas, 75232, United States|Tampere University Hospital, Tampere, 33521, Finland"
NCT05637086,Clinical Study Evaluating Safety of Pentoxifylline in Patients With Grand-Mal Epilepsy Treated by Phenytoin Monotherapy,https://clinicaltrials.gov/study/NCT05637086,NO,Epilepsy,DRUG: Phenytoin|DRUG: Pentoxifylline 400 MG,ALL,"ADULT, OLDER_ADULT",PHASE2,"Mansoura University, Mansoura, 35516, Egypt"
NCT06202196,Risk Prevention Program and Therapeutic Patient Education Program of Patients With Uncontrolled Epilepsy,https://clinicaltrials.gov/study/NCT06202196,NO,Epilepsy,PROCEDURE: Risk prevention session|PROCEDURE: Usual Therapeutic Patient Education (TPE) management,ALL,ADULT,NA,"CHU Gui de Chauliac, Montpellier, France"
NCT05096871,Association of Brain Derived Neurotrophic Factor (BDNF) rs6265 Gene Polymorphism With Susceptibility to Epilepsy,https://clinicaltrials.gov/study/NCT05096871,NO,Epilepsy,GENETIC: Genotyping by Real Time PCR,ALL,CHILD,,
NCT05325047,Preoperative Speech Rehabilitation in Drug-Resistant Temporal Epilepsy: A Case Study,https://clinicaltrials.gov/study/NCT05325047,NO,Epilepsy,PROCEDURE: Intensive speech rehabilitation,ALL,"ADULT, OLDER_ADULT",NA,"CHU Bordeaux, Bordeaux, 33000, France"
NCT00537940,Comparative Study Of Pregabalin And Gabapentin As Adjunctive Therapy In Subjects With Partial Seizures,https://clinicaltrials.gov/study/NCT00537940,YES,"Epilepsy|Partial Seizure Disorder|Epilepsies, Partial|Complex Partial Seizure Disorder",DRUG: Pregabalin|DRUG: Gabapentin,ALL,"ADULT, OLDER_ADULT",PHASE4,"Hospital Clinica Biblica, San Jose, Costa Rica|Instituto de Neurociencias, San Salvador, 01503, El Salvador|Clinica de Especialidades Neurologicas, San Salvador, El Salvador|Private Office, Guatemala Ciudad, 01014, Guatemala|Private Office, Guatemala, Guatemala|Clinica Anglo Americana, Lima, 27, Peru|Torre de Consultorios Clinica Anglo Americana, Lima, L-27, Peru|Hospital Nacional Guillermo Almenara Irigoyen - Essalud, Lima, L13, Peru"
NCT00706160,Language Mapping in Patients With Epilepsy,https://clinicaltrials.gov/study/NCT00706160,NO,"Epilepsy|Epilepsy, Temporal Lobe|Partial Epilepsy",,ALL,"CHILD, ADULT",,"National Institutes of Health Clinical Center, 9000 Rockville Pike, Bethesda, Maryland, 20892, United States"
NCT04876820,Impact of Pharmaceutical Interviews on the Medication Adherence of Epileptic Patients,https://clinicaltrials.gov/study/NCT04876820,NO,Epilepsy,OTHER: Pharmacist intervention|OTHER: Standard of care,ALL,"ADULT, OLDER_ADULT",NA,"Hopital Roger Salengro, CHU Lille, Lille, 59037, France"
NCT00522418,Study Comparing Best Medical Practice With or Without VNS Therapy in Pharmacoresistant Partial Epilepsy Patients,https://clinicaltrials.gov/study/NCT00522418,YES,Epilepsy|Partial Epilepsy,DEVICE: Vagal Nerve Simulation (VNS) Therapy|DRUG: Best Medical Practive,ALL,"CHILD, ADULT, OLDER_ADULT",PHASE4,"ULB-Hôpital Erasme, Centre de référence pour le traitement de l'épilepsie réfractaire - Neurologie, Brussels, 1070, Belgium|UZ Gent, Department of Neurology, 1K12/A, Gent, 9000, Belgium|Foothills Hospital, Neurology Department, Calgary, Alberta, T1Y6J4, Canada|QEII Health Sciences Centre, Halifax, Nova Scotia, B3H 3A7, Canada|Hopital Notre Dame, Montreal, Quebec, H2L 4M1, Canada|Montreal Neurological Institute, Clinical Research, Montreal, Quebec, H3A 2B4, Canada|CHU Grenoble, Neurology Department, Grenoble, 38043, France|Hopital Roger Salengro, Service de Neurologie, Lille, 59037, France|Hôpital Neurologique, Untité d'épileptologie, Lyon, 69003, France|Hôpital Gui De Chauliac, Service Explorations Neurologiques et Epileptologie, Montpellier, 34295, France|Hôpital Sainte-Anne, Service de Neurochirurgie, Paris, 75674, France|Service d'exploration des épilepsies, Strasbourg, 67091, France|CHU Tours, Service de neurologie, Tours, 37044, France|Universitätskliniken Bonn, Klinik für Epileptologie, Bonn, 53105, Germany|Universitätsklinik Erlangen, Zentrum für Epilepsie ZEE, Erlangen, 91054, Germany|Klinik der Ernst-Moritz-Arndt-Universität, Neurologische Klinik, Greifswald, 17487, Germany|Epilepsiezentrum Kork, Kehl-Kork, 77694, Germany|Klinikum der Philips-Universität Marburg, Fachbereich, 20 - Medizin / Klinik Neurologie / Epilepsie Zentrum, Marburg, 35039, Germany|Sächsisches Epilepsiezentrum Radeberg, Epilepsiezentrum Kleinwachau, Radeberg, 01465, Germany|Azienda Ospedaliero Universitaria - Ospedali Riuniti Umberto I - Lancisi - Salesi, NeuroPsichiatria Infantile, Ancona, 60100, Italy|Universita di Bologna, Clinica Neurologica, Bologna, 40123, Italy|Azienda Ospendaliero-Universitaria, Caressi Dep Neuroscience, Firenze, 50100, Italy|Ospedale San Paolo, Centro Epilessia, Milano, 20142, Italy|Universita degli Studi di Cagliari - Policlinico Monserrato, Clinica Neurologica, Monserrato, 09042, Italy|Universita di Pisa, Clinica Neurologica, Pisa, 56126, Italy|Ospedale F. Lotti, NeuroFisioPatalogia, Pontedera, 56025, Italy|Azienda Ospedaliera ""Bianchi Melacrino Morelli"", Centro Regionale Epilessie, Reggio Calabria, 89100, Italy|Università Cattolica Del Sacro Cuore, Istituto di NeuroChirurgia, Roma, 00168, Italy|Centro Epilessia, Dipartimento di Neuroscienze, Torino, 10126, Italy|Tergooiziekenhuizen, Dienst Neurologie, Blaricum, 1261, AN, Netherlands|Medisch Spectrum Twente, Dienst Neurologie, Enschede, 7513 R, Netherlands|Stichting Epilepsie Instituut Nederland, Dienst Neurologie, Heemstede, 8025 BV, Netherlands|Kempenhaeghe, Dienst Neurologie, Oosterhout, 4901 ZG, Netherlands|Medisch Centrum Rijnmond-Zuid, locatie Clara, Dienst Neurologie, Rotterdam, 3078 HT, Netherlands|Spesialsykehuset for Epilepsi, Dep of Neurodiagnostics, Sandvika, 1306, Norway|Hospital Ruber Internacional, Servicio de neurología, Madrid, 28034, Spain|Hospital Clínico de Santiago, Santiago de Compostela, 15706, Spain|Hospital Clínico Universitario, Servicio de neurología, Valencia, 46010, Spain|Hospital General de Valencia, Neurology/Neurophisiology, Valencia, 46014, Spain|Hospital General Basico De La Defensa de Valencia, Servicio de neurología, Valencia, 46930, Spain|Institute of Neuroscience and Physiology, Clinical Neuroscience and Rehabilitation, Goteborg, 41345, Sweden|Universitetssjukhuset i Lund, Neurologiska kliniken, Lund, 221 85, Sweden|Norrlands Universitetssjukhus, Neurocentrum, Umea, 901 85, Sweden|Akademiska sjukhuset, Neurocentrum, Uppsala, 751 85, Sweden|Addenbrookes Hospital, Dept of Neurosurgery, Cambridge, CB2 2QQ, United Kingdom|Walton Centre, Dept of Neurosciences, Clinical Sciences Centre, Fazakerley, L97LJ, United Kingdom|Kings College Hospital, Dept of Neurosurgery, London, SE5 9RS, United Kingdom|National Hospital for Neurology and Neurosurgery, London, WC1N3B, United Kingdom"
NCT00851331,Genetic Basis of Idiopathic Focal Epilepsies With Cognitif Deficits,https://clinicaltrials.gov/study/NCT00851331,NO,Epilepsy,GENETIC: genome analyzes (genetic defects and pathophysiological mechanisms ),ALL,"CHILD, ADULT, OLDER_ADULT",NA,"Hôpital Femme Mère Enfant - Hospices Civils de Lyon, Service Epilepsie, Sommeil et Exploration fonctionnelle neurologique pédiatrique, Bron, 69500, France|American Memorial Hospital, CHU de Reims, Unité de Neurologie Pédiatrique - Service Pédiatrie A, Reims, 51092, France|Clinique neurologique, Hôpitaux Universitaires de Strasbourg, Strasbourg, 67091, France|Hôpital de Hautepierre, Service de pédiatrie 1, Strasbourg, 67098, France"
NCT06427967,A Novel Social Emotional Learning Curriculum for Youth With Epilepsy,https://clinicaltrials.gov/study/NCT06427967,NO,Epilepsy,BEHAVIORAL: Project Dream Team,ALL,"CHILD, ADULT",NA,"Boston Medical Center, Neurology and remote, Boston, Massachusetts, 02118, United States"
NCT05722951,Metformin Efficacy and Safety in Epileptic Patients,https://clinicaltrials.gov/study/NCT05722951,NO,Epilepsy,DRUG: Levetiracetam|DRUG: Metformin,ALL,"ADULT, OLDER_ADULT",PHASE3,"Omnia Ashraf Abd El Aziz Ahmed Kotb, Alexandria, Egypt"
