NCT Number,Study Title,Study URL,Study Results,Conditions,Interventions,Sex,Age,Phases,Locations
NCT04953195,Thyroid Replacement Therapy in Patients With Subclinical Hypothyroidism,https://clinicaltrials.gov/study/NCT04953195,NO,Subclinical Hypothyroidisms,DRUG: Levothyroxine Sodium Tablets,ALL,"ADULT, OLDER_ADULT",PHASE4,"Beijing Chao-Yang Hospital, Capital Medical University, Beijing, Beijing, China"
NCT06083636,Improvement of Laboratory Diagnostics in Hypothyroid Patients Using Levothyroxine,https://clinicaltrials.gov/study/NCT06083636,NO,Hypothyroidism,OTHER: Single extra blood draw and completion of single questionnaire|OTHER: Single blood draw and completion of single questionnaire,ALL,"ADULT, OLDER_ADULT",,"Amsterdam UMC, Amsterdam, Noord-Holland, 1105 AZ, Netherlands"
NCT05143918,Quality of Life Among Egyptian Hypothyroid Patients,https://clinicaltrials.gov/study/NCT05143918,NO,Hypothyroidism,OTHER: assessment of quality of life using questionnaire,ALL,ADULT,,
NCT04795947,Correlation Between Thyroid Function and Quality of Life in Hypothyroidism,https://clinicaltrials.gov/study/NCT04795947,NO,Hypothyroidism,BEHAVIORAL: Behavioral,ALL,"ADULT, OLDER_ADULT",,"BeijingCYH, Beijing, Beijing, 100020, China"
NCT06345339,A Study to Assess the Safety and Efficacy of Oral Armour Thyroid Compared to Synthetic T4 for the Treatment of Primary Hypothyroidism in Adult Participants,https://clinicaltrials.gov/study/NCT06345339,NO,Hypothyroidism,DRUG: Armour Thyroid|DRUG: Levothyroxine,ALL,"ADULT, OLDER_ADULT",PHASE2|PHASE3,"Central Research Associates /ID# 255719, Birmingham, Alabama, 35205, United States|John Muir Medical Center /ID# 257103, Concord, California, 94520, United States|Diagnamics Inc. /ID# 262680, Encinitas, California, 92024, United States|NorCal Medical Research /ID# 256512, Greenbrae, California, 94904, United States|Velocity Clinical Research - Huntington Park /ID# 259044, Huntington Park, California, 90255-2951, United States|Diabetes Associates Medical Group /ID# 256949, Orange, California, 92866-2862, United States|Care Access - Santa Clarita /ID# 262573, Santa Clarita, California, 91321, United States|Diablo Clinical Research /ID# 261329, Walnut Creek, California, 94598, United States|San Fernando Valley Health Institute /ID# 257363, West Hills, California, 91304-3837, United States|New England Research Associates - Bridgeport /ID# 262184, Bridgeport, Connecticut, 06606, United States|Innovative Research of West Florida /ID# 257356, Clearwater, Florida, 33756-2004, United States|ALL Medical Research /ID# 256748, Cooper City, Florida, 33024, United States|Northeast Research Institute (NERI) /ID# 261841, Fleming Island, Florida, 32003, United States|Northeast Research Institute (NERI) /ID# 261846, Fleming Island, Florida, 32003, United States|The Center for Diabetes and Endocrine Care /ID# 255721, Fort Lauderdale, Florida, 33312, United States|Encore Medical Research LLC /ID# 256758, Hollywood, Florida, 33021, United States|East Coast Institute For Research - LaVilla - West Monroe Street /ID# 256972, Jacksonville, Florida, 32204, United States|The University of Florida Heal /ID# 257361, Jacksonville, Florida, 32207-4966, United States|East Coast Research - Jacksonville /ID# 256971, Jacksonville, Florida, 32216, United States|Encore Research Group-Jacksonville Center for Clinical Research /ID# 256147, Jacksonville, Florida, 32216, United States|South Florida Wellness & Clinic /ID# 256513, Margate, Florida, 33063, United States|Med Research of Florida /ID# 257837, Miami, Florida, 33186, United States|Adult Medicine of Lake County - Mount Dora /ID# 257371, Mount Dora, Florida, 32757, United States|Suncoast Clinical Research Pasco County /ID# 257018, New Port Richey, Florida, 34652, United States|West Orange Endocrinology /ID# 256139, Ocoee, Florida, 34761-4547, United States|Suncoast Clinical Research - Palm Harbor /ID# 256741, Palm Harbor, Florida, 34684, United States|Comprehensive Medical & Research Center /ID# 261678, Plantation, Florida, 33317-2911, United States|Northeast Research institute /ID# 261857, Saint Augustine, Florida, 32080-6010, United States|Metabolic Research Inst /ID# 255729, West Palm Beach, Florida, 33401, United States|East Coast Institute for Research - Canton /ID# 256974, Canton, Georgia, 30114, United States|Columbus Regional Research Ins /ID# 255738, Columbus, Georgia, 31904, United States|Physicians Research Associates, LLC /ID# 255675, Lawrenceville, Georgia, 30046, United States|East Coast Institute for Research - Macon /ID# 256529, Macon, Georgia, 31210, United States|Endocrine Research Solutions /ID# 256784, Roswell, Georgia, 30076, United States|Rocky Mountain Clinical Research, LLC /ID# 256753, Idaho Falls, Idaho, 83404-7596, United States|West Broadway Clinic /ID# 256756, Council Bluffs, Iowa, 51501-3822, United States|Iowa Diabetes and Endocrinology Research Center /ID# 256750, West Des Moines, Iowa, 50265, United States|Cotton O'Neil Digestive Health Center /ID# 256749, Topeka, Kansas, 66606-1539, United States|L-MARC Research Center /ID# 255733, Louisville, Kentucky, 40213-1014, United States|Nola Care Clinical Research /ID# 260145, Metairie, Louisiana, 70006-2930, United States|Omega Clinical Research /ID# 260162, Metairie, Louisiana, 70006-2930, United States|NECCR PrimaCare Research, LLC /ID# 256531, Fall River, Massachusetts, 02721, United States|Metro Detroit Endocrinology Center /ID# 260862, Dearborn, Michigan, 48126, United States|Michigan Healthcare Professionals /ID# 260859, Farmington Hills, Michigan, 48334-1566, United States|Elite Clinical Research Center /ID# 256782, Flint, Michigan, 48532, United States|Diabetes and Endocrinology Specialists /ID# 259068, Chesterfield, Missouri, 63017, United States|Jefferson City Medical Group /ID# 257099, Jefferson City, Missouri, 65109, United States|Billings Clinic /ID# 258316, Billings, Montana, 59101-0733, United States|Mercury Street Medical /ID# 259632, Butte, Montana, 59701-1652, United States|Methodist Physicians Clinic /ID# 259276, Omaha, Nebraska, 68114, United States|Palm Research Center /ID# 256131, Las Vegas, Nevada, 89148, United States|Northern Nevada Endocrinology /ID# 259646, Reno, Nevada, 89511, United States|Southern New Hampshire Diabetes and Endocrinology /ID# 257841, Nashua, New Hampshire, 03060, United States|Research Foundation of SUNY - University of Buffalo /ID# 261019, Buffalo, New York, 14203, United States|NYC Research /ID# 258662, New York, New York, 10001, United States|Endocrine Assc Long Island PC /ID# 257357, Smithtown, New York, 11787, United States|Physician's East Endocrinology /ID# 256491, Greenville, North Carolina, 27834, United States|Carteret Medical Group /ID# 256869, Morehead City, North Carolina, 28557, United States|Lucas Research /ID# 256127, Morehead City, North Carolina, 28557, United States|Lucas Research /ID# 257061, Morehead City, North Carolina, 28557, United States|Accellacare Wilmington /ID# 256744, Wilmington, North Carolina, 28401, United States|Diabetes and Endocrinology Associates of Stark County Inc /ID# 256751, Canton, Ohio, 44718, United States|Lynn Institute of Norman /ID# 256785, Norman, Oklahoma, 73072, United States|Lynn Institute of Oklahoma City /ID# 263141, Oklahoma City, Oklahoma, 73112, United States|Diabetes & Endocrinology Consultants of Pennsylvania /ID# 259064, Feasterville-Trevose, Pennsylvania, 19053, United States|Jefferson Health - Roosevelt Boulevard /ID# 256837, Philadelphia, Pennsylvania, 19114-1025, United States|Trial Management Associates - Myrtle Beach /ID# 259800, Myrtle Beach, South Carolina, 29572, United States|Carolina Endocrine Associates Llc /ID# 259640, North Charleston, South Carolina, 29406-9823, United States|Chattanooga Medical Research /ID# 257631, Chattanooga, Tennessee, 37404-3239, United States|Mid State Endocrine Associates /ID# 259641, Nashville, Tennessee, 37203, United States|Texas Diabetes and Endocrinology - Central Austin /ID# 255728, Austin, Texas, 78731, United States|Texas Diabetes and Endocrinology - South Austin /ID# 255723, Austin, Texas, 78749, United States|Brusco, Corpus Christi, TX /ID# 256746, Corpus Christi, Texas, 78414, United States|North TX Endocrine Center /ID# 255737, Dallas, Texas, 75231, United States|Research Institute Dallas /ID# 256126, Dallas, Texas, 75231, United States|Academy of Diabetes, Thyroid and Endocrine /ID# 255735, El Paso, Texas, 79935, United States|Diabetes and Thyroid Center of Ft. Worth /ID# 256781, Fort Worth, Texas, 76132, United States|Juno Research /ID# 259238, Houston, Texas, 77040-5059, United States|Biopharma Informatic - Houston - Business Center Drive /ID# 256149, Houston, Texas, 77043, United States|PlanIt Research, PLLC /ID# 259221, Houston, Texas, 77079-2204, United States|Endocrine and Psychiatry Cente /ID# 259631, Houston, Texas, 77095, United States|Tekton Research /ID# 260988, Irving, Texas, 75039-2523, United States|Southern Endocrinology Associates /ID# 256795, Mesquite, Texas, 75149, United States|Texas Diabetes and Endocrinology /ID# 255722, Round Rock, Texas, 78681, United States|Northeast Clinical Research of San Antonio, LLC /ID# 256868, San Antonio, Texas, 78233, United States|Diabetes & Glandular Disease Clinic /ID# 255734, San Antonio, Texas, 78237, United States|Consano Clinical Research, LLC /ID# 256138, Shavano Park, Texas, 78231, United States|Texas Valley Clinical Research /ID# 261476, Weslaco, Texas, 78596, United States|Virginia Endocrinology Research /ID# 259623, Chesapeake, Virginia, 23321, United States|Rainier Clinical Research /ID# 255802, Renton, Washington, 98055, United States"
NCT05334771,Early Detection of Endolymphatic Hydrops in Hypothyroid Patients,https://clinicaltrials.gov/study/NCT05334771,NO,Hypothyroidism,DEVICE: Dual band pure tune audiometer,ALL,ADULT,,
NCT05015725,"The Relationship Between Serum rT3 Concentrations, T3/T4 Ratio, and Symptoms/Quality of Life in Treated Hypothyroid Patients",https://clinicaltrials.gov/study/NCT05015725,NO,Hypothyroidism,"DIAGNOSTIC_TEST: Quality of life assessment, biochemical measures",ALL,"ADULT, OLDER_ADULT",,"Semmelweis University - Departement Medicine and Oncology, Budapest, 1083, Hungary"
NCT05823012,Study of XP-8121 For the Treatment of Adult Subjects With Hypothyroidism,https://clinicaltrials.gov/study/NCT05823012,NO,Hypothyroidism,DRUG: levothyroxine sodium,ALL,"ADULT, OLDER_ADULT",PHASE2,"ProSciento, Inc., Chula Vista, California, 91911, United States|Catalina Research Institute, L.L.C., Montclair, California, 91763, United States|Panax Clinical Research, LLC, Miami Lakes, Florida, 33014, United States|American Research Corporation, San Antonio, Texas, 78215, United States|Mt. Olympus Medical Research, LLC, Sugar Land, Texas, 77479, United States|Rainier Clinical Research Center, Renton, Washington, 98057, United States"
NCT04878614,Comparison of Levothyroxine Formulation in Hypothyroid Patients With Enteral Feeding,https://clinicaltrials.gov/study/NCT04878614,NO,Hypothyroidism,DRUG: Levothyroxine Tablet|DRUG: Levothyroxine Sodium,ALL,"ADULT, OLDER_ADULT",PHASE4,"UCLA Center for Human Nutrition, Los Angeles, California, 90024, United States"
NCT04236232,The Impact of Subclinical Hypothyroidism on Cardiovascular System,https://clinicaltrials.gov/study/NCT04236232,NO,Hypothyroidism,DIAGNOSTIC_TEST: Thyroid function,ALL,ADULT,,
NCT04332770,Biosignals by Wearable Devices in Hypothyroidism,https://clinicaltrials.gov/study/NCT04332770,NO,Hypothyroidism,OTHER: levothyroxine withdrawal,ALL,ADULT,,"Seoul National University Bundang Hospital, Seongnam-si, Gyeonggi-do, 13620, Korea, Republic of"
NCT03631771,Pediatric Risk of Hypothyroidism With Iodinated Contrast Media,https://clinicaltrials.gov/study/NCT03631771,NO,Hypothyroidism,DRUG: Iohexol|DRUG: Iodixanol|DRUG: Iopromide|DRUG: Ioversol,ALL,CHILD,PHASE4,
NCT02024906,Effect of Soy Intake on Cardiovascular Disease Biomarkers in Subclinical Hypothyroid Participants,https://clinicaltrials.gov/study/NCT02024906,NO,Cardiovascular Disease|Subclinical Hypothyroid,DIETARY_SUPPLEMENT: soy protein isolate (SPI)|DIETARY_SUPPLEMENT: milk protein isolate (MPI),ALL,"ADULT, OLDER_ADULT",NA,"University of Kansas Medical Center, Kansas City, Kansas, 66160, United States"
NCT03342001,Hypothyroidism Treated With Calcitonin,https://clinicaltrials.gov/study/NCT03342001,YES,Hypothyroidism,DRUG: Calcitonin,ALL,"ADULT, OLDER_ADULT",PHASE4,"University of Maryland Center for Diabetes and Endocrinology, Baltimore, Maryland, 21201, United States"
NCT02959827,Iodinated Contrast Agents and Risk of Hypothyroidism in Young Children in the United States,https://clinicaltrials.gov/study/NCT02959827,YES,Hypothyroidism,DRUG: Iodinated contrast agents,ALL,CHILD,,"Oakland, Oakland, California, 94612, United States"
NCT05314790,"Management of Patients With Diagnosis of Hypothyroidism, as Hospitalized and as Outpatients, in Internal Medicine Units: Observational Study Before & After Educational Programme",https://clinicaltrials.gov/study/NCT05314790,NO,Hypothyroidism,OTHER: intervening Educational Program,ALL,"ADULT, OLDER_ADULT",,"ULSS1 Belluno San Martino, Belluno, Italy|Ospedale Versilia, Camaiore, Italy|Ospedale di Canicattì, Canicattì, Italy|Ospedale di Castiglione del Lago, Medicina del Trasimeno, Castiglione Del Lago, Italy|Garibaldi Nesima, Catania, Italy|Ospedale G.B. Morgagni - P.L. Pierantoni, Forlì, Italy|Ospedale G.P. Delogu, Ghilarza, Italy|Ospedale Gubbio-Gualdo Tadino, Gubbio, Italy|Ospedale ""F. Veneziale"", Isernia, Italy|ASL Latina, Latina, Italy|Ospedale S. Andrea, Massa Marittima, Italy|Ospedale S. Croce di Moncalieri - ASL TO5, Moncalieri, Italy|Ospedale Del Mare, Napoli, Italy|Ospedale Fatebenefratelli, Napoli, Italy|Ospedale Maggiore di Novara, Novara, Italy|Ospedale Civico di Partinico, Palermo, Italy|Ospedale ""Bianchi-Melacrino-Morelli"", Reggio Calabria, Italy|Casa Sollievo della Sofferenza, San Giovanni Rotondo, Italy|AOU di Sassari, Sassari, Italy|Ospedale San Paolo, Savona, Italy"
NCT03180892,Non-immune Related Hypothyroidism in Iodine Sufficient Area,https://clinicaltrials.gov/study/NCT03180892,NO,Hypothyroidism,OTHER: The investigators did not apply any intervention for the participants.,ALL,"ADULT, OLDER_ADULT",,
NCT05712421,A Study Evaluation the Safety and Efficacy of Hormone Replacement Therapy With North Star Compared to Levothyroxine in Patients With Primary Hypothyroidism,https://clinicaltrials.gov/study/NCT05712421,NO,Hypothyroidism,DRUG: North Star|DRUG: Levothyroxine,ALL,"ADULT, OLDER_ADULT",PHASE2,"Neuvosyn Investigational Site, Birmingham, Alabama, 35209, United States|Neuvosyn Investigational Site, Canoga Park, California, 91304, United States|Neuvosyn Investigational Site, Greenbrae, California, 94904, United States|Neuvosyn Investigational Site, Toluca Lake, California, 91602, United States|Neuvosyn Investigational Site, Boca Raton, Florida, 33434, United States|Neuvosyn Investigational Site, Miami, Florida, 33144, United States|Neuvosyn Investigational Site, Miami, Florida, 33145, United States|Neuvosyn Investigational Site, Miami, Florida, 33155, United States|Neuvosyn Investigational Site, Miami, Florida, 33174, United States|Neuvosyn Investigational Site, Miami, Florida, 33179, United States|Neuvosyn Investigational Site, Sunrise, Florida, 33351, United States|Neuvosyn Investigational Site, Acworth, Georgia, 30101, United States|Neuvosyn Investigational Site, Atlanta, Georgia, 30318, United States|Neuvosyn Investigational Site, Columbus, Georgia, 31904, United States|Neuvosyn Investigational Site, Sugar Hill, Georgia, 30024, United States|Neuvosyn Investigational Site, Saginaw, Michigan, 48602, United States|Neuvosyn Investigational Site, Gladstone, Missouri, 64118, United States|Neuvosyn Investigational Site, Williamsville, New York, 14221, United States|Neuvosyn Investigational Site, Denver, North Carolina, 28037, United States|Neuvosyn Investigational Site, Winston-Salem, North Carolina, 27103, United States|Neuvosyn Investigational Site, Beavercreek, Ohio, 45440, United States|Neuvosyn Investigational Site, Columbus, Ohio, 31904, United States|Neuvosyn Investigational Site, Georgetown, Texas, 78628, United States|Neuvosyn Investigational Site, Houston, Texas, 77040, United States|Neuvosyn Investigational Site, Katy, Texas, 77450, United States|Neuvosyn Investigational Site, Katy, Texas, 77494, United States|Neuvosyn Investigational Site, Lewisville, Texas, 75067, United States|Neuvosyn Investigational Site, Paris, Texas, 75462, United States|Neuvosyn Investigational Site, Pearland, Texas, 77584, United States|Neuvosyn Investigational Site, Stafford, Texas, 77477, United States"
NCT05412979,A Study Evaluating the Safety and Efficacy of Hormone Replacement Therapy With ST-1891 Compared to Levothyroxine in Patients With Primary Hypothyroidism,https://clinicaltrials.gov/study/NCT05412979,NO,Hypothyroidism,DRUG: ST-1891|DRUG: Levothyroxine,ALL,"ADULT, OLDER_ADULT",PHASE2,"Sention Investigational Site, Greenbrae, California, 94904, United States|Sention Investigational Site, Newhall, California, 91321, United States|Sention Investigational Site, Denver, Colorado, 80246, United States|Sention Investigational Site, Fort Lauderdale, Florida, 33312, United States|Sention Investigational Site, Jacksonville, Florida, 32258, United States|Sention Investigational Site, New Port Richey, Florida, 34652, United States|Sention Investigational Site, Palm Harbor, Florida, 34684, United States|Sention Investigational Site, Atlanta, Georgia, 30318, United States|Sention Investigational Site, Lawrenceville, Georgia, 30046, United States|Sention Investigational Site, Roswell, Georgia, 30076, United States|Sention Investigational Site, Evergreen Park, Illinois, 60805, United States|Sention Investigational Site, Newburgh, Indiana, 47630, United States|Sention Investigational Site, South Bend, Indiana, 46617, United States|Sention Investigational Site, Ankeny, Iowa, 50023, United States|Sention Investigational Site, Louisville, Kentucky, 40213, United States|Sention Investigational Site, Dearborn, Michigan, 48126, United States|Sention Investigational Site, Chesterfield, Missouri, 63017, United States|Sention Investigational Site, Jefferson City, Missouri, 65109, United States|Sention Investigational Site, Staten Island, New York, 10301, United States|Sention Investigational Site, Cary, North Carolina, 27518, United States|Sention Investigational Site, Greenville, North Carolina, 27834, United States|Sention Investigational Site, Hickory, North Carolina, 28601, United States|Sention Investigational Site, Morehead City, North Carolina, 28557, United States|Sention Investigational Site, Raleigh, North Carolina, 27609, United States|Sention Investigational Site, Rocky Mount, North Carolina, 27804, United States|Sention Investigational Site, Salisbury, North Carolina, 28144, United States|Sention Investigational Site, Wilmington, North Carolina, 28401, United States|Sention Investigational Site, Mount Pleasant, South Carolina, 29464, United States|Sention Investigational Site, Bristol, Tennessee, 37620, United States|Sention Investigational Site, Chattanooga, Tennessee, 37411, United States|Sention Investigational Site, Memphis, Tennessee, 38133, United States|Sention Investigational Site, Austin, Texas, 78731, United States|Sention Investigational Site, Austin, Texas, 78749, United States|Sention Investigational Site, Benbrook, Texas, 76132, United States|Sention Investigational Site, Live Oak, Texas, 78233, United States|Sention Investigational Site, Round Rock, Texas, 78681, United States|Sention Investigational Site, Webster, Texas, 77598, United States|Sention Investigational Site, Virginia Beach, Virginia, 23462, United States|Sention Investigational Site, Renton, Washington, 98057, United States"
NCT03257566,Hypothyroidism in Patients With Type 1 Diabetes,https://clinicaltrials.gov/study/NCT03257566,NO,Hypothyroidism,,ALL,CHILD,,
NCT02993562,"Hypothyroidism, Metabolism and Food Intake",https://clinicaltrials.gov/study/NCT02993562,NO,Hypothyroidism,DRUG: Levothyroxine,FEMALE,"ADULT, OLDER_ADULT",,"Center for Diabetes Research, Herlev and Gentofte Hospitals, Copenhagen, Region Hovedstaden, 2900, Denmark"
NCT02577367,Mean Percentage of Levothyroxine Dosage Increase in Patients With Hypothyroidism Started on Enteral Feeding,https://clinicaltrials.gov/study/NCT02577367,NO,Hypothyroidism,DRUG: Levothyroxine,ALL,"ADULT, OLDER_ADULT",PHASE4,"Maimonides Medical Center, Brooklyn, New York, 11219, United States"
NCT00565864,Neurocognitive and Metabolic Effects of Mild Hypothyroidism,https://clinicaltrials.gov/study/NCT00565864,YES,Hypothyroidism,DRUG: L-thyroxine (L-T4),ALL,"ADULT, OLDER_ADULT",PHASE4,"Oregon Health and Science University, Portland, Oregon, 97201, United States"
NCT03095963,Interaction Between Levothyroxine and Probiotics in Hypothyroid Patients,https://clinicaltrials.gov/study/NCT03095963,NO,Hypothyroidism,OTHER: a mixture of highly charged Lactobacilli and Bifidobacteria (VSL#3®)|DRUG: levothyroxin,ALL,"ADULT, OLDER_ADULT",NA,
NCT00818896,Maternal Hypothyroidism in Pregnancy,https://clinicaltrials.gov/study/NCT00818896,NO,Hypothyroidism,,FEMALE,"CHILD, ADULT",,"Women & Infants Hospital, Providence, Rhode Island, 02905, United States"
NCT02766283,Observational Study on Hypothyroidism in Young Children Following Iodine Contrast Exposure,https://clinicaltrials.gov/study/NCT02766283,YES,Hypothyroidism,DRUG: iodinated contrast agents,ALL,CHILD,,"Multiple Locations, Israel"
NCT06205303,Interventional Study to Improve Medication Adherence Using Patient Decision Aid,https://clinicaltrials.gov/study/NCT06205303,NO,Hypothyroidism,OTHER: Patient Decision Aid (Video),ALL,"ADULT, OLDER_ADULT",NA,"SingHealth Polyclinics, Singapore, Singapore"
NCT00524238,Metabolic Changes in Hypothyroid Patients,https://clinicaltrials.gov/study/NCT00524238,NO,Hypothyroidism,DRUG: L-thyroxine,ALL,"ADULT, OLDER_ADULT",NA,"Aarhus University Hospital, Aarhus, 8000, Denmark"
NCT02917863,Randomized Crossover Trial for the Evaluation of the Possible Effects in the Intestine of Two Different Pharmaceutical Forms of L - Thyroxine in Patients With Primary Acquired Hypothyroidism,https://clinicaltrials.gov/study/NCT02917863,NO,Hypothyroidism,"DRUG: L-Thyroxine (tablet, per os)|DRUG: L-Thyroxine (oral drops, solution)",ALL,"CHILD, ADULT",PHASE4,"Meyer Children's Hospital, Florence, Italy"
NCT02364102,Effect of Hypothyroidism on Brown Adipose Tissue,https://clinicaltrials.gov/study/NCT02364102,NO,Hypothyroidism,,ALL,"ADULT, OLDER_ADULT",,"University Hospital Basel, Department of Endocrinology, Basel, BS, 4031, Switzerland"
NCT02891668,"Hypothyroidism, Metabolism and Quality of Life - Focus on QOL, REE, Cognitive Function and Body Composition",https://clinicaltrials.gov/study/NCT02891668,NO,Hypothyroidism,DRUG: Levothyroxine treatment,ALL,"ADULT, OLDER_ADULT",,"Department of internal Medicine, Herlev Hospital, Herlev, Region Hovedstaden, DK-2730, Denmark"
NCT01197183,"Observational Study With Prospective and/or Retrospective Follow-up, Without Modifying Patient Treatment and Follow-up Practices for the Initial Treatment of Hypothyroidism in France",https://clinicaltrials.gov/study/NCT01197183,NO,Hypothyroidism,,ALL,ADULT,,"Merck Lipha Santé Laboratories, Saint Romain, Lyon, 69008, France"
NCT02567877,Is Levothyroxine Alone Adequate Thyroid Hormone Replacement?,https://clinicaltrials.gov/study/NCT02567877,NO,Postsurgical Hypothyroidism|Hypothyroidism,PROCEDURE: thyroidectomy|DRUG: levothyroxine in thyroidectomy patients,ALL,"ADULT, OLDER_ADULT",,"University of Colorado Anschutz Medical Campus, Aurora, Colorado, 80045, United States"
NCT02467244,"Effect of Levothyroxine on Serum Adiponectin, Insulin Resistance and Cardiovascular Risk in Patients With Hypothyroidism",https://clinicaltrials.gov/study/NCT02467244,NO,Hypothyroidism,DRUG: Levothyroxine,ALL,"ADULT, OLDER_ADULT",,"AIIMS, Bhubaneswar, Bhubaneshwar, Odisha, 751019, India"
NCT00206375,Growth Hormone and GnRH Agonist in Adolescents With Acquired Hypothyroidism,https://clinicaltrials.gov/study/NCT00206375,YES,Hypothyroidism,DRUG: Growth hormone|DRUG: Growth hormone treatment and puberty,ALL,CHILD,PHASE4,"Baylor college of Medicine, Houston, Texas, 77030, United States"
NCT01769157,Effects of L-carnitine on Hypothyroidism,https://clinicaltrials.gov/study/NCT01769157,NO,Hypothyroidism,DRUG: L-carnitine|DRUG: Placebo,ALL,"ADULT, OLDER_ADULT",PHASE4,"Korea University Anam Hospital, Seoul, Korea, Republic of"
NCT01800617,A Study of T3 Therapy in Patients With Hypothyroidism,https://clinicaltrials.gov/study/NCT01800617,NO,Hypothyroidism,"DRUG: Liothyronine, Sodium",ALL,"ADULT, OLDER_ADULT",PHASE2,"Georgetown University Hospital, Washington, District of Columbia, 20007, United States"
NCT00403390,Generic vs. Name-Brand Levothyroxine,https://clinicaltrials.gov/study/NCT00403390,YES,Congenital Hypothyroidism|Hypothyroidism,DRUG: Brand Name Levothyroxine (Synthroid)|DRUG: Generic formulation of Levothyroxine,ALL,"CHILD, ADULT",NA,"Children's Hospital Boston, Boston, Massachusetts, 02115, United States"
NCT02094079,Monitoring and Evaluation of the Levothyroxin Replacement Therapy in Pregnant Women With Hypothyroidism,https://clinicaltrials.gov/study/NCT02094079,NO,Hypothyroidism,OTHER: biomedical outcomes,FEMALE,ADULT,,"Endocrine Unit O, Herlev Hospital, University of Copenhagen, Herlev, dk 2730, Denmark"
NCT05821881,REduction of LEvothyroxine in Adults; a SElf Controlled Study,https://clinicaltrials.gov/study/NCT05821881,NO,Hypothyroidism,OTHER: Discontinuation of levothyroxine treatment,ALL,"ADULT, OLDER_ADULT",,"Leiden University Medical Center, Leiden, 2300 RC, Netherlands"
NCT03926585,Variations in the DIO2 and MCT10 Genes and Effect of Triiodothyronine Treatment,https://clinicaltrials.gov/study/NCT03926585,NO,Hypothyroidism,,ALL,"ADULT, OLDER_ADULT",,"Herlev Hospital, Herlev, 2730, Denmark"
