NCT Number,Study Title,Study URL,Study Results,Conditions,Interventions,Sex,Age,Phases,Locations
NCT05803967,Baduanjin Exercising Effects on Sub-clinical Hypothyroidism and Cognitive Problems,https://clinicaltrials.gov/study/NCT05803967,NO,Subclinical hypothyroïdism|Cognitive Impairment,BEHAVIORAL: Baduanjin exercising,FEMALE,OLDER_ADULT,NA,"Cairo Unoversity, Giza, Egypt"
NCT04270110,Assessment of Bone Mineral Density in Patients With Subclinical Hypothyroidism,https://clinicaltrials.gov/study/NCT04270110,NO,Subclinical hypothyroïdism,,ALL,"CHILD, ADULT",,"Assiut university Hospital, Assuit, 71511Assuit, Egypt"
NCT04124705,A Study of Armour® Thyroid Compared to Synthetic T4 (Levothyroxine) in Previously Hypothyroid Participants,https://clinicaltrials.gov/study/NCT04124705,YES,Hypothyroidism|Thyroid Disease|Euthyroid|Thyroid Gland|Thyroid Hormones,DRUG: Armour® Thyroid|DRUG: Levothyroxine,ALL,"ADULT, OLDER_ADULT",PHASE2,"Sponsor Site /ID# 237950, Birmingham, Alabama, 35205, United States|Sponsor Site /ID# 237986, Little Rock, Arkansas, 72209-7040, United States|Sponsor Site /ID# 235210, Greenbrae, California, 94904, United States|Sponsor Site /ID# 235716, Huntington Beach, California, 92648, United States|Sponsor Site /ID# 238120, Sacramento, California, 95821-2123, United States|Sponsor Site /ID# 238026, Santa Clarita, California, 91321, United States|Sponsor Site /ID# 238258, Van Nuys, California, 91405-3605, United States|Sponsor Site/ID# 235866, Denver, Colorado, 80246, United States|Sponsor Site /ID# 235853, Fort Lauderdale, Florida, 33312, United States|Sponsor Site /ID# 236809, West Palm Beach, Florida, 33401, United States|Sponsor Site /ID# 235032, Atlanta, Georgia, 30318, United States|Sponsor Site /ID# 237199, Columbus, Georgia, 31904, United States|Sponsor Site /ID# 238088, Lawrenceville, Georgia, 30046, United States|Sponsor Site /ID# 235714, Lexington, Kentucky, 40503, United States|Sponsor Site /ID# 236701, Louisville, Kentucky, 40213-1014, United States|Sponsor Site /ID# 235202, Asheville, North Carolina, 28803, United States|Sponsor Site/ID# 235204, Greenville, North Carolina, 27834, United States|Sponsor Site /ID# 238023, Hickory, North Carolina, 28601, United States|Sponsor Site /ID# 237137, Austin, Texas, 78731, United States|Sponsor Site/ID# 238071, Austin, Texas, 78749, United States|Sponsor Site/ID# 237652, Dallas, Texas, 75231, United States|Sponsor Site/ID# 237655, Dallas, Texas, 75231, United States|Sponsor Site /ID# 235870, El Paso, Texas, 79935, United States|Sponsor Site /ID# 235860, Round Rock, Texas, 78681, United States|Sponsor Site /ID# 235894, San Antonio, Texas, 78229, United States|Sponsor Site /ID# 235211, Renton, Washington, 98057, United States|Sponsor Site /ID# 236022, Spokane, Washington, 99202, United States|Sponsor Site/ID# 236977, Tacoma, Washington, 98405, United States"
NCT03574051,the Microbiota Are Associated With Iodine-131 Therapy and Hypothyroidism,https://clinicaltrials.gov/study/NCT03574051,NO,Microbiota,DRUG: Probiotic,ALL,"ADULT, OLDER_ADULT",EARLY_PHASE1,"First affiliated hospital of Harbin medical university, Harbin, Heilongjiang, 150001, China"
NCT02017080,Fetal Thyroid Ultrasound And Fetal Thyroid Hormones,https://clinicaltrials.gov/study/NCT02017080,NO,Pregnancy Complicated by Hyperthyroidism|Hypothyroidism in Pregnancy,,FEMALE,ADULT,,"Clinic for Gynecology and Obstetrics , Clinical Center of Serbia, Belgrade, 11000, Serbia"
NCT01488721,Clinical Evaluation of NeoPlex4 Assay and NeoPlex System,https://clinicaltrials.gov/study/NCT01488721,NO,"Adrenal Hyperplasia, Congenital|Congenital Hypothyroidism|Cystic Fibrosis",,ALL,CHILD,,"New York State Department of Health, Albany, New York, 12201, United States|Tennessee Department of Health, Nashville, Tennessee, 37243, United States|Unified State Laboratories: Public Health, Taylorsville, Utah, 84129, United States"
NCT06135948,Impact of Increasing Levothyroxine Dose in Ramadan for UAE Patients With Hypothyroidism,https://clinicaltrials.gov/study/NCT06135948,NO,L-thyroxine,"DRUG: Extra dose of L-thyroxine, 25 mcg during Ramadan",ALL,"ADULT, OLDER_ADULT",PHASE4,"Family Promotion Centre, Endocrinology Clinic, Sharjah, United Arab Emirates"
NCT06377826,"Comparison of Aerobic and Resistance Training on Exercise Capacity, Depression and Quality of Life in Hypothyroidism.",https://clinicaltrials.gov/study/NCT06377826,NO,Comparison of Aerobic Exercise and Resistance Training,OTHER: aerobic exercises|OTHER: resistance training|DRUG: medication,ALL,ADULT,NA,"Abbottabad medical complex, Abbottābād, Khyber Pakhtunkhwa, 21300, Pakistan"
NCT02186405,Effects of Levothyroxine Treatment on Hemodynamic and Renal Functions in Subclinical Hypothyroidism,https://clinicaltrials.gov/study/NCT02186405,NO,Subclinical hypothyroïdism,DRUG: LEVOTHYROXINE,ALL,"ADULT, OLDER_ADULT",PHASE4,"Nephrology Department, Nice, 06202, France"
NCT06036576,Thyroxine Therapy for Recurrent Pregnancy Loss in Hypothyroid Women,https://clinicaltrials.gov/study/NCT06036576,NO,Recurrent Early Pregnancy Loss|Thyroid Diseases,DRUG: Levothyroxine Pill,FEMALE,ADULT,PHASE3,"AL-Elwiyah Maternity Teaching Hospital, Baghdad, 10011, Iraq"
NCT03115515,Safety and Efficacy of Empiric Levothyroxine (LT4) Dose Increase Versus Individualized LT4 Dose Increase in Hypothyroid Women During Pregnancy,https://clinicaltrials.gov/study/NCT03115515,NO,Pregnancy Related|Thyroid,DRUG: levothyroxine,FEMALE,ADULT,NA,"Medstar Washington Hospital Center, Washington, District of Columbia, 20010, United States"
NCT04178928,Can Levothyroxine Treatment Reduce the Development of Cardio-metabolic Disorder in Subclinical Hypothyroidism?,https://clinicaltrials.gov/study/NCT04178928,NO,Subclinical hypothyroïdism,DRUG: Levothyroxine,ALL,CHILD,PHASE1|PHASE2,
NCT02710799,Evaluation of the Effects of Teleconsultations on a Endocrinology Referral List,https://clinicaltrials.gov/study/NCT02710799,NO,Diabetes Mellitus|Hypothyroidism|Hyperthyroidism|Goiter|Thyroid Nodule|Obesity,OTHER: Teleconsultation|OTHER: Protocol,ALL,"ADULT, OLDER_ADULT",NA,"Secretaria Estadual da Saúde, Porto Alegre, Rio Grande do Sul, 90110-150, Brazil"
NCT06353555,Efficacy of Thyroid Hormone Replacement for Secondary Hypothyroidism Following Intracerebral Hemorrhage,https://clinicaltrials.gov/study/NCT06353555,NO,Intracerebral Hemorrhage|Low T3 Syndrome|Neurocritical Care|Hormone Replacement Therapy,DRUG: Euthyrox|DRUG: Euthyrox,ALL,"ADULT, OLDER_ADULT",NA,"Peking union medical college hospital, Beijing, Beijing, 100730, China"
NCT06041204,Best Treatment for Women With Both (Polycystic Ovary Syndrome) PCOS and Subclinical Hypothyroidism,https://clinicaltrials.gov/study/NCT06041204,NO,PCOS (Polycystic Ovary Syndrome) of Bilateral Ovaries|Subclinical Hypothyroidism|Female Infertility,DRUG: Letrozole 2.5mg|DRUG: Levothyroxine 25 Mcg (0.025 Mg) Oral Tablet,FEMALE,ADULT,NA,"Al-Hussein University Hospital, Cairo, 11633, Egypt"
NCT04663451,An Assessment of the Occurrence of Hypothyroidism in Patients Treated With RAI for Hyperthyroidism.,https://clinicaltrials.gov/study/NCT04663451,NO,Nodule Solitary Thyroid|Toxic Multinodular Goiter|Radioactive Iodine-Induced Hypothyroidism,RADIATION: radioacive iodine therapy,ALL,"ADULT, OLDER_ADULT",,"Universitair Ziekenhuis Brussel, Brussels, 1090, Belgium"
NCT03699098,The Incidence and Risk Factors of Radiotherapy Induced Hypothyroidism in Head and Neck Cancer With Long Term Follow up,https://clinicaltrials.gov/study/NCT03699098,NO,Head and Neck Cancer,"DIAGNOSTIC_TEST: TSH, T3, T4 and thyroid gland DVH",ALL,"ADULT, OLDER_ADULT",NA,"Department of clinical oncology and nuclear medicine, Cairo university, Cairo, 11311, Egypt"
NCT01950260,Early Levothyroxine Post Radioactive Iodine,https://clinicaltrials.gov/study/NCT01950260,YES,Graves' Disease,DRUG: Levothyroxine|OTHER: Placebo,ALL,"ADULT, OLDER_ADULT",PHASE2|PHASE3,"Mayo Clinic in Rochester, Rochester, Minnesota, 55905, United States"
NCT02500342,Effect of Thyroid Hormone Replacement on Fatigability in Untreated Older Adults With Subclinical Hypothyroidism,https://clinicaltrials.gov/study/NCT02500342,NO,Thyroid Dysfunction|Mental Fatigue|Fatigue,DRUG: Levothyroxine|DRUG: Placebo,ALL,OLDER_ADULT,PHASE4,"University College Cork, National University of Ireland, Cork, Cork, Ireland|Department of General Internal Medicine, Lausanne, Vaud, 1011, Switzerland|Clinic for General Internal Medicine, Bern University Hospital Bern, Bern, 3010, Switzerland"
NCT03372772,Effect of Levocarnitine Supplementation for the Management of Fatigue in Levothyroxine-Treated Hypothyroid Patients,https://clinicaltrials.gov/study/NCT03372772,NO,Patient Compliance,DRUG: Levocarnitine,ALL,ADULT,NA,"Phamacology Department, BSMMU, Dhaka, Shahbag, 1000, Bangladesh"
