NCT Number,Study Title,Study URL,Study Results,Conditions,Interventions,Sex,Age,Phases,Locations
NCT05928962,An Exploratory Single-arm Study: PD-1 With Recombinant Human Adenovirus Type 5 Injection for Malignant Melanomas,https://clinicaltrials.gov/study/NCT05928962,NO,Malignant Melanomas,DRUG: Recombinant Human Adenovirus Type 5 Injection,ALL,"ADULT, OLDER_ADULT",PHASE1,"Fujian Cancer Hospital, Department of Internal Medicine, Ward 19, Fuzhou, Fujian, China"
NCT01502696,Adjuvant PEG Intron in Ulcerated Melanoma,https://clinicaltrials.gov/study/NCT01502696,NO,Ulcerated Melanomas,BIOLOGICAL: PEG IFN alfa-2b,ALL,"ADULT, OLDER_ADULT",PHASE3,"Medical University of Graz, Graz, Austria|Hopitaux Universitaires Bordet-Erasme - Institut Jules Bordet, Brussels, Belgium|Universitair Ziekenhuis Gent, Ghent, Belgium|U.Z. Leuven - Campus Gasthuisberg, Leuven, Belgium|Aarhus University Hospital, Aarhus, 8000, Denmark|Herlev Hospital - University Copenhagen, Herlev, Denmark|Odense University Hospital, Odense, Denmark|Assistance Publique - Hopitaux de Paris - Hopital Avicenne, Bobigny, France|CHU de Bordeaux - Groupe Hospitalier Saint-André - Hopital Saint-Andre (Bordeaux, France, Bordeaux, France|CHU de Grenoble - La Tronche - Hôpital A. Michallon, Grenoble, France|CHRU de Lille, Lille, France|Centre Leon Berard, Lyon, France|Assistance Publique - Hopitaux de Marseille - Hôpital de La Timone, Marseille, France|CHU de Nice - CHU de Nice - Hopital De L'Archet, Nice, France|Assistance Publique - Hopitaux de Paris - CHU Ambroise Pare, Paris, France|Assitance Publique - Hopitaux de Paris - Hopital Bichat-Claude Bernard, Paris, France|Assitance Publique - Hopitaux de Paris - Hopital Saint-Louis, Paris, France|Institut Gustave Roussy, Paris, France|Centre Hospitalier De Pau, Pau, France|CHU de Reims - Hôpital Robert Debré, Reims, France|CHU d'Amiens - CHU Amiens - Hopital Sud, Salouel, France|Universitaetsklinikum, Essen, Germany|Universitaetsklinikum Heidelberg - Hautklinik / Dermatologic Department, Heidelberg, Germany|Universitaetsklinikum Heidelberg - Hautklinik, Heidelburg, Germany|Universitaetsklinikum Schleswig-Holstein, Kiel, Germany|Universitaetsklinikum Koeln, Koeln, Germany|Medizinische Universitaet Zu Luebeck, Luebeck, Germany|Johannes Gutenberg Universitaetskliniken - Mainz University Medical Center, Mainz, Germany|UniversitaetsMedizin Mannheim, Mannheim, Germany|Universitaetsklinikum Wuerzburg, Wuerzburg, Germany|IRCCS - Istituto Tumori ""Giovanni Paolo II"", Bari, Italy|Istituto Europeo di Oncologia, Milan, Italy|Istituto Nazionale Tumori IRCCS ""Fondazione G. Pascale"", Napoli, Italy|Istituto Dermopatico Dell'Immacolata, Roma, Italy|Azienda Ospedaliero-Universitaria ""Santa Maria della Misericordia"" di Udine, Udine, Italy|The Netherlands Cancer Institute-Antoni Van Leeuwenhoekziekenhuis, Amsterdam, Netherlands|Vrije Universiteit Medisch Centrum, Amsterdam, Netherlands|Leiden University Medical Centre, Leiden, Netherlands|Maria Sklodowska-Curie Memorial Cancer Centre, Warsaw, Poland|I.P.O. Francisco Gentil - Centro De Lisboa, Lisboa, 1099-023, Portugal|I.P.O. Francisco Gentil - Centro De Lisboa, Lisboa, Portugal|Hospital Distrital De Santarem, Santarem, Portugal|Hospital Clinic Universitari, Barcelona, Spain|Hospital Universitario 12 De Octubre, Madrid, Spain|UniversitaetsSpital Zurich, Zurich, Switzerland|Clatterbridge Centre for Oncology NHS Trust - Clatterbridge Cancer Centre NHS Foundation Trust, Bebington, United Kingdom|University Hospitals Birmingham NHS Foundation Trust (UHB) - Queen Elisabeth Medical Centre, Birmingham, United Kingdom|Mid Essex Hospitals - Broomfield Hospital, Broomfield, United Kingdom|Cambridge University Hospital NHS - Addenbrookes Hospital, Cambridge, United Kingdom|Cheltenham General Hospital, Cheltenham, United Kingdom|NHS Greater Glasgow and Clyde - Beatson West of Scotland Cancer Centre - Gartnavel General Hospital, Glasgow, United Kingdom|Leeds Teaching Hospitals NHS Trust - St. James's University Hospital, Leeds, United Kingdom|St George's Hospital NHS Trust (6961), London, United Kingdom|The Christie NHS Foundation Trust, Manchester, United Kingdom|Norfolk And Norwich Hospital, Norwich, United Kingdom|Nottingham University Hospitals NHS Trust - City Hospital, Nottingham, United Kingdom|University Hospital Southampton NHS Foundation Trust - Southampton General Hospital, Southampton, United Kingdom|St Helens and Knowsley Teaching Hospitals, St Helens, United Kingdom"
NCT03783325,Assessing Gene-Environment Interactions in Clinical Presentation of Nevi and Melanoma,https://clinicaltrials.gov/study/NCT03783325,NO,Nevi and Melanomas,BEHAVIORAL: UV Counseling|OTHER: UV Photo|OTHER: Biological Sample,ALL,"ADULT, OLDER_ADULT",NA,"University of Colorado, Aurora, Colorado, 80045, United States"
NCT04020809,Neoadjuvant Atezolizumab in Cutaneous Melanoma,https://clinicaltrials.gov/study/NCT04020809,NO,Cutaneous Melanoma,DRUG: Atezolizumab,ALL,"ADULT, OLDER_ADULT",PHASE1,"Houston Methodist Hospital, Houston, Texas, 77030, United States"
NCT03541148,Evaluation of Oncoxin-Viusid® in Cutaneous Melanoma,https://clinicaltrials.gov/study/NCT03541148,NO,"Cutaneous Melanoma, Stage II|Malignant Cutaneous Melanoma|Cutaneous Melanoma, Stage III",DIETARY_SUPPLEMENT: Oncoxin-Viusid,ALL,"ADULT, OLDER_ADULT",PHASE2,"Manuel Fajardo Clinical Surgical University Hospital, La Habana, 10600, Cuba"
NCT04702854,Evaluation of Ultrasound Biomicroscopy in the Local Staging of Cutaneous Melanoma,https://clinicaltrials.gov/study/NCT04702854,NO,Cutaneous Melanoma,DIAGNOSTIC_TEST: Ultrasound Biomicroscopy,ALL,"ADULT, OLDER_ADULT",NA,"CHU de Nice, Nice, France"
NCT05172232,Diagnostic Precision of the AI Tool Dermalyzer to Identify Malignant Melanomas in Subjects Seeking Primary Care for Melanoma-suspected Cutaneous Lesions,https://clinicaltrials.gov/study/NCT05172232,NO,Malignant Melanoma,DIAGNOSTIC_TEST: Dermalyzer,ALL,"ADULT, OLDER_ADULT",,"Region Östergötland Primary Care, Linköping, Docent, 58185, Sweden|Region Stockholm Primary Care, Stockholm, Sweden|Region Kalmar and Kronoberg, Växjö, Sweden"
NCT05572463,A Platform Study of Novel Immunotherapy Products in Participants With Previously Treated Unresectable or Metastatic Cutaneous Melanoma,https://clinicaltrials.gov/study/NCT05572463,NO,Unresectable Cutaneous Melanoma|Metastatic Cutaneous Melanoma,COMBINATION_PRODUCT: Sintilimab + IBI110,ALL,"ADULT, OLDER_ADULT",PHASE1|PHASE2,"University of California San Francisco Medical Center, San Francisco, California, 94143, United States|Henry Ford Hospital, Detroit, Michigan, 48202, United States|Hackensack University Medical Center, Hackensack, New Jersey, 07601, United States|Princess Victoria Hospital, Woolloongabba, Queensland, 4102, Australia|Hospices Civil De Lyon Nord - Centre Hospitalier Lyon Sud - Dermatologie, Lyon, 69002, France|Hospital Saint Louis, Paris, 75010, France|Universitatsklinikum Carl Gustav Carus, Dresden, 01307, Germany|Universitatsklinikum Essen, Essen, 45147, Germany|Institut Catala d'Oncologia Hospital Universitari Germans Trials I Pujol, Barcelona, Barcelona, 8916, Spain|Hospital Universitario Reina Sofia, Cordoba, Córdoba, 14004, Spain|Universitaets Spital Zurich, Zürich, 8091, Switzerland|Cambridge University Hospitals NHS Foundation Trust (Oxford), Cambridge, CB2 0QQ, United Kingdom|Lancashire Teaching Hospitals (Preston), Preston, PR2 9HT, United Kingdom"
NCT04253080,Expression of IL4 Induced Gene 1 in Patients With Cutaneous Melanoma: Value in Prognosis and/or in Predictive Response to Immune Checkpoint Inhibitors,https://clinicaltrials.gov/study/NCT04253080,NO,Cutaneous Melanoma,BIOLOGICAL: Blood sample|BIOLOGICAL: Cutaneous melanoma biopsy,ALL,"ADULT, OLDER_ADULT",NA,"Dermatology department, Paris, Ile De France, 75014, France"
NCT02355587,Five Year Study to Track Use of DecisionDX-Melanoma Test in Patients With Cutaneous Melanoma and Associated Patient Outcomes,https://clinicaltrials.gov/study/NCT02355587,NO,Cutaneous Melanoma,,ALL,"CHILD, ADULT, OLDER_ADULT",,"Sutter Health, Santa Rosa, California, 95403, United States|Elizabeth Liotta Dermatology, Frederick, Maryland, 21702, United States|University of Nevada, Las Vegas, Nevada, 89102, United States|South Carolina Skin Care Center, Greenville, South Carolina, 29607, United States"
NCT03313206,Neoadjuvant Treatment Associated With Maintenance Therapy by Anti-PD1 Immunotherapy in Patients With Resectable Head and Neck Mucosal Melanoma,https://clinicaltrials.gov/study/NCT03313206,NO,Head and Neck Mucosal Melanomas,DRUG: Pembrolizumab|PROCEDURE: Surgery|RADIATION: IMRT|DRUG: Lenvatinib,ALL,"ADULT, OLDER_ADULT",PHASE2,"Gustave Roussy, Villejuif, Val De Marne, 94805, France"
NCT05253872,The MELAcare Study: A New Method for Surveillance of Melanoma Patients,https://clinicaltrials.gov/study/NCT05253872,NO,Cutaneous Melanoma,OTHER: The MelaCare intervention,ALL,"ADULT, OLDER_ADULT",NA,"Herlev and Gentofte Hospital, Copenhagen, 2730, Denmark"
NCT02288897,PV-10 vs Chemotherapy or Oncolytic Viral Therapy for Treatment of Locally Advanced Cutaneous Melanoma,https://clinicaltrials.gov/study/NCT02288897,YES,Cutaneous Melanoma,"DRUG: PV-10 (10% rose bengal disodium)|DRUG: Dacarbazine, temozolomide or talimogene laherparepvec",ALL,"ADULT, OLDER_ADULT",PHASE3,"Sharp Memorial Hospital - Clinical Oncology Research, San Diego, California, 92123, United States|Mount Sinai Comprehensive Cancer Center, Miami Beach, Florida, 33140, United States|Moffitt Cancer Center and Research Institute, Tampa, Florida, 33612, United States|Washington University School of Medicine - Dermatology, Saint Louis, Missouri, 63110, United States|Dartmouth-Hitchcock Medical Center, Lebanon, New Hampshire, 03756, United States|Atlantic Health System, Morristown, New Jersey, 07960, United States|Wake Forest Baptist Health, Winston-Salem, North Carolina, 27157, United States|Oklahoma Cancer Specialists and Research Institute, Tulsa, Oklahoma, 74146, United States|St Luke's University Hospital and Health Network, Easton, Pennsylvania, 18045, United States|Penn State Hershey Cancer Institute, Hershey, Pennsylvania, 17033, United States|M.D. Anderson Cancer Center, Houston, Texas, 77030, United States|Huntsman Cancer Institute, Salt Lake City, Utah, 84112, United States|Unité Cancéro-Dermatologie, Hôtel-Dieu CHU Nantes, Nantes, France|Institut Claudius Regaud, IUCT ONCOPOLE, Toulouse, 31059, France|Klinik für Dermatologie, Venerologie und Allergologie Charite Universitätsmedizin Berlin, Berlin, Germany|Klinik für Dermatologie Universitätsklinikum Essen Studienzentrum, Essen, Germany|Klinik für Dermatologie, Venerologie und Allergologie Universitätsklinikum Schleswig-Holstein Hautkrebszentrum, Kiel, Germany|Hautklinik Klinikum der Johannes Gutenberg Universität Hautkrebszentrum, Mainz, Germany|IRCCS Instituto Nazionale Tumori ""Fondazione Giovanni Pascale"", Napoli, Italy|Istituto Dermopatico dell'Immacolata (IDI IRCCS), Rome, Italy|Azienda Sanitaria Azienda Ospedaliera Universitaria Senese, Siena, Italy|Centro de Estudios y Prevención del Cancer A.C., Juchitán de Zaragoza, Oaxaca, 70000, Mexico|Neurociencias Estudios Clínicos S.C., Culiacán, Sinaloa, 80020, Mexico"
NCT03396952,Prostaglandin Inhibition and Immune Checkpoint Blockade in Melanoma,https://clinicaltrials.gov/study/NCT03396952,YES,Stage III Cutaneous Melanoma|Stage IIIA Cutaneous Melanoma|Stage IIIB Cutaneous Melanoma|Stage IIIC Cutaneous Melanoma|Stage IV Cutaneous Melanoma,DRUG: Aspirin|BIOLOGICAL: Ipilimumab|OTHER: Laboratory Biomarker Analysis|BIOLOGICAL: Pembrolizumab,ALL,"ADULT, OLDER_ADULT",PHASE2,"University of Califonia, San Francisco, San Francisco, California, 94143, United States"
NCT04884997,A Study of Toripalimab or Combining With Temozolomide（iv） in the Treatment of Advanced/Metastatic Malignant Melanoma,https://clinicaltrials.gov/study/NCT04884997,NO,Malignant Melanoma,DRUG: toripalimab|DRUG: Temozolomide Injection,ALL,"ADULT, OLDER_ADULT",PHASE2,"Department of Medical Onocology, First Affiliated Hospital of Zhejiang University, Hangzhou, Zhejiang, 310003, China"
NCT02355574,5-year Study to Track Clinical Application of DecisionDx-Melanoma Gene Expression Profile Assay Results,https://clinicaltrials.gov/study/NCT02355574,NO,Cutaneous Melanoma,,ALL,"CHILD, ADULT, OLDER_ADULT",,"Northside Hospital, Atlanta, Georgia, 30342, United States|University of Louisville, Louisville, Kentucky, 40202, United States|Saint Louis University, Saint Louis, Missouri, 63103, United States"
NCT04778449,"Quality of Life, Lifestyle, and Psychosocial Factors in Patients With Melanoma",https://clinicaltrials.gov/study/NCT04778449,NO,Cutaneous Melanoma,OTHER: Medical Chart Review|OTHER: Questionnaire Administration,ALL,"ADULT, OLDER_ADULT",,"M D Anderson Cancer Center, Houston, Texas, 77030, United States"
NCT04274816,Intradermal Injection of Anti-CTLA-4 in Patients With Stage I/II Melanoma,https://clinicaltrials.gov/study/NCT04274816,NO,Cutaneous Melanoma,DRUG: Tremelimumab,ALL,"ADULT, OLDER_ADULT",PHASE1,
NCT04253574,Comparison of PET/CT and Ultrasound in Staging of Malignant Melanoma,https://clinicaltrials.gov/study/NCT04253574,NO,Malignant Melanoma,DIAGNOSTIC_TEST: Imaging with 18F-FDG PET/CT and/or Ultrasound,ALL,"ADULT, OLDER_ADULT",,
NCT03842943,Neoadjuvant Combination Immunotherapy for Stage III Melanoma,https://clinicaltrials.gov/study/NCT03842943,NO,Cutaneous Melanoma,DRUG: Pembrolizumab|DRUG: Talimogene Laherparepvec,ALL,"ADULT, OLDER_ADULT",PHASE2,"University of Louisville, Louisville, Kentucky, 40202, United States"
NCT00424515,Imatinib in Patients With Mucosal or Acral/Lentiginous Melanoma,https://clinicaltrials.gov/study/NCT00424515,YES,Mucosal Melanoma|Acral/Lentiginous Melanoma|Chronically Sun Damaged Melanomas,DRUG: Imatinib,ALL,"ADULT, OLDER_ADULT",PHASE2,"University of Colorado at Denver Health Sciences Center, Denver, Colorado, 80045, United States|H. Lee Moffitt Cancer Center, Tampa, Florida, 33612, United States|University of Chicago, Chicago, Illinois, 60637, United States|Dana-Farber Cancer Institute, Boston, Massachusetts, 02115, United States|MD Anderson Cancer Center, Houston, Texas, 77030, United States"
NCT03655756,pDNA Intralesional Cancer Vaccine for Cutaneous Melanoma,https://clinicaltrials.gov/study/NCT03655756,YES,"Cutaneous Melanoma, Stage III|Cutaneous Melanoma, Stage IV",BIOLOGICAL: IFx-Hu2.0,ALL,"ADULT, OLDER_ADULT",EARLY_PHASE1,"H. Lee Moffitt Cancer Center, Tampa, Florida, 33612, United States"
NCT04924413,L-TIL Plus Tislelizumab as First-line Treatment in Advanced Malignant Melanoma,https://clinicaltrials.gov/study/NCT04924413,NO,Malignant Melanoma,DRUG: Tislelizumab,ALL,"ADULT, OLDER_ADULT",PHASE2,"Affiliated Cancer Hospital of Zhengzhou University & Henan Cancer Hospital, Zhengzhou, Henan, 450008, China"
NCT01729663,"Phase II/III Clinical Study CSF470 Plus BCG Plus GM-CSF vs IFN Alpha 2b in Stage IIB, IIC and III Melanoma Patients",https://clinicaltrials.gov/study/NCT01729663,NO,Cutaneous Melanoma,"BIOLOGICAL: CSF470 vaccine, BCG, Molgramostim|DRUG: interferon alpha 2b",ALL,"ADULT, OLDER_ADULT",PHASE2|PHASE3,"Instituto Médico Alexander Fleming, Buenos Aires, Capital Federal, 1426, Argentina"
NCT00991250,SentoClone® Compared to Reference Treatment in Advanced Malignant Melanoma,https://clinicaltrials.gov/study/NCT00991250,NO,Malignant Melanoma,BIOLOGICAL: SentoClone®|DRUG: Temodal® or Dacarbazine Medac®,ALL,"CHILD, ADULT, OLDER_ADULT",PHASE2,"Lunds Universitetssjukhus, Lund, Skåne, 22185, Sweden|Södersjukhuset, Stockholm, Stockholms Län, 11883, Sweden|Karolinska Sjukhuset, Stockholm, Stockholms Län, 17176, Sweden|Norrlands Universitetssjukhus, Umeå, Västerbottens Län, 90185, Sweden|Sahlgrenska Universitetssjukhuset, Göteborg, Västra Götalands Län, 41685, Sweden"
NCT04123470,A Phase I/II Trial Investigating LOAd703 in Combination With Atezolizumab in Malignant Melanoma,https://clinicaltrials.gov/study/NCT04123470,NO,Malignant Melanoma,GENETIC: delolimogene mupadenorepvec|BIOLOGICAL: atezolizumab,ALL,"ADULT, OLDER_ADULT",PHASE1|PHASE2,"Cedars-Sinai Medical Center, The Angeles Clinic and Research Institute, Los Angeles, California, 90025, United States|Baylor St Luke's Medical Center, Houston, Texas, 77030, United States|Uppsala University Hospital, Uppsala, 75185, Sweden"
NCT04648163,Suction Drain in Axillary Lymph Node Dissection for Malignant Melanoma,https://clinicaltrials.gov/study/NCT04648163,NO,Malignant Melanoma,,ALL,"CHILD, ADULT, OLDER_ADULT",,"Medical University of Graz, Graz, Styria, 8036, Austria"
NCT03649529,Treatment of Malignant Melanoma With GPA-TriMAR-T Cell Therapy,https://clinicaltrials.gov/study/NCT03649529,NO,Malignant Melanoma,BIOLOGICAL: GPA-TriMAR-T,ALL,"ADULT, OLDER_ADULT",EARLY_PHASE1,"Hainan Cancer Hospital, Haikou, Hainan, 570100, China|The Second Affiliated Hospital of Hainan Medical University, Haikou, Hainan, 570100, China"
NCT00087477,A Pilot Study of Pivanex in Patients With Malignant Melanoma,https://clinicaltrials.gov/study/NCT00087477,NO,Malignant Melanoma,DRUG: Pivanex,ALL,"ADULT, OLDER_ADULT",PHASE1|PHASE2,"Mt. Sinai Comprehensive Cancer Center, Miami Beach, Florida, 33140, United States"
NCT01247623,Trial With Telomerase Peptide Vaccine In Combination With Temozolomide in Patients With Advanced Malignant Melanoma,https://clinicaltrials.gov/study/NCT01247623,NO,Malignant Melanoma,BIOLOGICAL: GV1001,ALL,"ADULT, OLDER_ADULT",PHASE1|PHASE2,"Oslo University Hospital, Oslo, Postbox 4953, 0424, Norway"
NCT04593485,Anti-PD-1 Antibody in the Treatment of Patients With Malignant Melanoma of the Female Genital Tract,https://clinicaltrials.gov/study/NCT04593485,NO,Malignant Melanoma,DRUG: Camrelizumab for injection,FEMALE,"ADULT, OLDER_ADULT",PHASE2,"Fudan University Shanghai Cancer Center, Shanghai, Shanghai, 200032, China|Fudan University Shanghai Cancer Center, Shanghai, China"
NCT02068196,A National Phase IV Study With Ipilimumab for Patients With Advanced Malignant Melanoma.,https://clinicaltrials.gov/study/NCT02068196,NO,Malignant Melanoma,PROCEDURE: Blood sampling for Pre-existing immunity|DRUG: Ipilimumab,ALL,"ADULT, OLDER_ADULT",PHASE4,"Haukeland University Hospital, Bergen, Norway|Nordland Hospital Bodø, Bodø, Norway|Sørlandet Hospital, Kristiansand, Kristiansand, Norway|Oslo University Hospital, Oslo, Norway|Stavanger University Hospital, Stavanger, Norway|University Hospital of North Norway, Tromsø, Norway|Trondheim University Hospital, St.Olavs Hospital, Trondheim, Norway|Ålesund Hospital, Ålesund, Norway"
NCT00323206,Phase I Trial of Intratumoral pIL-12 Electroporation in Malignant Melanoma,https://clinicaltrials.gov/study/NCT00323206,NO,Malignant Melanoma,BIOLOGICAL: IL-12p DNA|PROCEDURE: Intratumoral Electroporation,ALL,"ADULT, OLDER_ADULT",NA,"H. Lee Moffitt Cancer Center & Research Institute, Tampa, Florida, 33612, United States"
NCT05200143,"Study of Ipilimumab, Nivolumab, and Cabozantinib in Patients With Cutaneous Melanoma",https://clinicaltrials.gov/study/NCT05200143,NO,Refractory Cutaneous Melanoma,DRUG: Ipilimumab|DRUG: Nivolumab|DRUG: Cabozantinib,ALL,"ADULT, OLDER_ADULT",PHASE2,"Providence Portland Medical Center, Portland, Oregon, 97213, United States"
NCT00513604,Phase II Study of Short-Term Cultured Anti-Tumor Autologous Lymphocytes After Lymphocyte-Depleting Chemotherapy in Metastatic Melanoma,https://clinicaltrials.gov/study/NCT00513604,YES,"Melanoma|Malignant Melanoma|Melanoma, Experimental|Experimental Melanomas",BIOLOGICAL: aldesleukin|BIOLOGICAL: therapeutic autologous lymphocytes|DRUG: Cyclophosphamide|DRUG: Fludarabine phosphate|RADIATION: Total body irradiation,ALL,"ADULT, OLDER_ADULT",PHASE2,"National Institutes of Health Clinical Center, 9000 Rockville Pike, Bethesda, Maryland, 20892, United States"
NCT00498836,"Multicentre, Dose Finding, Ph II,CP-4055 in Comb. With Sorafenib - Patients With Metastatic Malignant Melanoma",https://clinicaltrials.gov/study/NCT00498836,NO,Malignant Melanoma,DRUG: CP-4055|DRUG: Sorafenib (Nexavar),ALL,"ADULT, OLDER_ADULT",PHASE2,"University of Pittsburgh Cancer Institute, Pittsburgh, Pennsylvania, 15232, United States|Cancer Therapy and Research Center, Institute for Drug Development, San Antonio, Texas, 78229, United States|The Norwegian Radium Hospital, Oslo, NO-0310, Norway|Lund University Hospital, Lund, SE-221 85, Sweden|Umeå University Hospital, Umeå, Sweden|Uppsala University Hospital, Uppsala, SE-751 85, Sweden"
NCT01557114,Study of Radiotherapy Administered in Combination With Ipilimumab in Patients With Unresectable Stage III or Stage IV Advanced Malignant Melanoma,https://clinicaltrials.gov/study/NCT01557114,NO,Malignant Melanoma,DRUG: Ipilimumab|RADIATION: Radiotherapy,ALL,"ADULT, OLDER_ADULT",PHASE1,"Gustave Roussy Cancer Campus, Villejuif, Val de Marne, 94805, France|Institut Gustave Roussy, Villejuif, 94805, France"
NCT03116412,A Randomized Trial to Assess the Role of Imaging During Follow up After Radical Surgery of High Risk Melanoma,https://clinicaltrials.gov/study/NCT03116412,NO,Malignant Melanoma,PROCEDURE: CT or PET scans,ALL,"ADULT, OLDER_ADULT",NA,"Södra Älvsborgs sjukhus, Boras, Sweden|Mälarsjukhuset Eskilstuna, Eskilstuna, Sweden|Falu lasarett, Falun, Sweden|Gävle sjukhus, Gavle, Sweden|Department of Surgery, Sahlgrenska University Hospital, Gothenburg, Sweden|Helsingborgs lasarett, Helsingborg, Sweden|Länssjukhuset Ryhov, Jonkoping, Sweden|Länssjukhuset i Kalmar, Kalmar, Sweden|Centralsjukhuset i Karlstad, Karlstad, Sweden|Linköping University Hospital, Linkoping, Sweden|Skåne University Hospital, Malmö, Sweden|Örebro University Hospital, Orebro, Sweden|Skaraborgs sjukhus Skövde, Skovde, Sweden|Karolinska University Hospital, Stockholm, Sweden|Länssjukhuset Sundsvall, Sundsvall, Sweden|Uddevalla sjukhus, Uddevalla, Sweden|Umeå University Hospital, Umea, Sweden|Akademiska sjukhuset, Uppsala, Sweden|Västmanlands sjukhus Västerås, Vasteras, Sweden|Visby lasarett, Visby, Sweden"
NCT02275416,Safety of UV1 Vaccination in Combination With Ipilimumab in Patients With Unresectable or Metastatic Malignant Melanoma,https://clinicaltrials.gov/study/NCT02275416,NO,Malignant Melanoma,DRUG: Ipilimumab|BIOLOGICAL: UV1 vaccine|BIOLOGICAL: GM-CSF,ALL,"ADULT, OLDER_ADULT",PHASE1|PHASE2,"Oslo University Hospital, Radiumhospitalet, Oslo, 0379, Norway"
NCT01227551,A Study of Intratumoral CAVATAK™ in Patients With Stage IIIc and Stage IV Malignant Melanoma (VLA-007 CALM ),https://clinicaltrials.gov/study/NCT01227551,YES,Malignant Melanoma,BIOLOGICAL: Coxsackievirus A21 (CVA21),ALL,"ADULT, OLDER_ADULT",PHASE2,"Moores UCSD Cancer Center, La Jolla, California, 92093, United States|St Mary's Medical Center, San Francisco, California, 94117, United States|Mount Sinai Medical Center, Miami Beach, Florida, 33140, United States|Rush University Medical Center, Chicago, Illinois, 60612, United States|Oncology Specialists, SC, Niles, Illinois, 60714, United States|Investigative Clinical Research of Indiana, Indianapolis, Indiana, 46260, United States|Atlantic Melanoma Center, Morristown, New Jersey, 07962, United States|Providence Cancer Center, Portland, Oregon, 97213, United States|Mary Crowley Cancer Research Centers, Dallas, Texas, 75201, United States|Huntsman Cancer Institute, Salt Lake City, Utah, 84112, United States"
NCT04285749,Prevention of Recurrence and Metastasis in Genetically High-Risk Melanomas,https://clinicaltrials.gov/study/NCT04285749,NO,Malignant Melanoma,DRUG: Fluvastatin|OTHER: RNA-sequencing|OTHER: Gene expression profiling,ALL,"ADULT, OLDER_ADULT",EARLY_PHASE1,
NCT00535314,Study of Two Dose Levels of RTA 402 in Patients With Advanced Malignant Melanoma,https://clinicaltrials.gov/study/NCT00535314,NO,Malignant Melanoma,DRUG: RTA 402 Dose1|DRUG: RTA 402 Dose2,ALL,"ADULT, OLDER_ADULT",PHASE2,
NCT00963261,Quality of Life and Psychological Well-being in Patients With Malignant Melanoma,https://clinicaltrials.gov/study/NCT00963261,NO,Malignant Melanoma,BEHAVIORAL: psycho-oncological intervention,ALL,"ADULT, OLDER_ADULT",NA,"University Medical Center Freiburg, Department of Dermatology, Freiburg, 79104, Germany|University Medical Center Collogne, Department of Dermatology, Köln, 50937, Germany"
