NCT Number,Study Title,Study URL,Study Results,Conditions,Interventions,Sex,Age,Phases,Locations
NCT01942603,Minimal SN Tumor Burden,https://clinicaltrials.gov/study/NCT01942603,NO,Cutaneous Melanoma,,ALL,"ADULT, OLDER_ADULT",,"U.Z. Leuven - Campus Gasthuisberg, Leuven, Belgium|CHRU de Lille, Lille, France|CHU de Nice - Hopital De L'Archet, Nice, France|Institut Gustave Roussy, Paris, France|Charite - Universitaetsmedizin Berlin - Campus Mitte, Berlin, Germany|Universitaetsklinikum - Essen, Essen, Germany|UniversitaetsMedizin Mannheim, Mannheim, Germany|Istituto Europeo di Oncologia, Milan, Italy|Istituto Nazionale Tumori IRCCS - Fondazione G. Pascale, Napoli, Italy|Istituto Oncologico Veneto IRCCS - Ospedale Busonera, Padova, Italy|The Netherlands Cancer Institute-Antoni Van Leeuwenhoekziekenhuis, Amsterdam, Netherlands|Erasmus MC Cancer Institute - location Daniel den Hoed, Rotterdam, Netherlands|Maria Sklodowska-Curie Memorial Cancer Centre, Warsaw, Poland|The Institute Of Oncology, Ljubljana, Slovenia|Hospital Clinic Universitari, Barcelona, Spain|Centre Hospitalier Universitaire Vaudois, Lausanne, Switzerland|Royal Bournemouth Hospital, Bournemouth, United Kingdom|Cambridge University Hospital NHS - Addenbrookes Hospital, Cambridge, United Kingdom|Guy's and St Thomas' NHS - St Thomas Hospital, London, United Kingdom|St George's Hospital NHS Trust, London, United Kingdom|Norfolk And Norwich Hospital, Norwich, United Kingdom|St Helens & Knowsley NHS Trust - Whiston Hospital, Prescott, United Kingdom"
NCT01278940,Trial of Vaccine Therapy With mRNA- Transfected Dendritic Cells in Patients With Advanced Malignant Melanoma,https://clinicaltrials.gov/study/NCT01278940,NO,Malignant Melanoma,BIOLOGICAL: Dendritic Cells (DC) malignant melanoma|PROCEDURE: IL-2,ALL,"ADULT, OLDER_ADULT",PHASE1|PHASE2,
NCT03843593,A Study To See Why Patients Agree To or Decline To Have Treatment After Surgery,https://clinicaltrials.gov/study/NCT03843593,NO,Cutaneous Melanoma,BEHAVIORAL: Demographics Questionnaire|BEHAVIORAL: Adjuvant Treatment Beliefs Scale10|BEHAVIORAL: Functional Assessment of Cancer Therapy - Melanoma (FACT-M)11|BEHAVIORAL: Functional Assessment of Chronic Illness Therapy - Treatment Satisfaction - General (FACIT-TS-G)13|BEHAVIORAL: Decisional Regret14|BEHAVIORAL: Clinician Preference for Treatment,ALL,"ADULT, OLDER_ADULT",,"Memorial Sloan Kettering Basking Ridge (All Protocol Activities), Basking Ridge, New Jersey, 07920, United States|Memorial Sloan Kettering Westchester (All Protocol Activities), Harrison, New York, 10604, United States|Memorial Sloan Kettering Cancer Center, New York, New York, 10065, United States"
NCT00145158,Immunization With 8 Peptides Mixed With CpG 7909 or Montanide ISA51 in Patients With Metastatic Cutaneous Melanoma,https://clinicaltrials.gov/study/NCT00145158,YES,Malignant Melanoma,BIOLOGICAL: 8 HLA-A2-restricted peptides and Montanide ISA51|BIOLOGICAL: 8 HLA-A2-restricted peptides and CpG 7909,ALL,"ADULT, OLDER_ADULT",PHASE1|PHASE2,"Clinique Universitaires St-Luc, Brussels, B-1200, Belgium|Ludwig Institute for Cancer Research, Brussels, B-1200, Belgium"
NCT00235482,Intratumoural Administration of Coxsackievirus A21 for the Control of Malignant Melanoma (PXS-X02),https://clinicaltrials.gov/study/NCT00235482,NO,Malignant Melanoma,DRUG: Coxsackievirus A21,ALL,"ADULT, OLDER_ADULT",PHASE1,"Melanoma Unit, Mater Misericordiae Hospital, Newcastle, New South Wales, 2298, Australia"
NCT03628417,Confirmatory Trial in the Evaluation of Ca Electroporation for the Treatment of Cutaneous Metastases,https://clinicaltrials.gov/study/NCT03628417,YES,Cutaneous Melanoma,PROCEDURE: Calcium Electroporation|PROCEDURE: Bleomycin based electrochemotherapy,ALL,"ADULT, OLDER_ADULT",NA,
NCT00358319,Phase I/II Trial of Valproic Acid and Karenitecin for Melanoma,https://clinicaltrials.gov/study/NCT00358319,NO,Malignant Melanoma,DRUG: Karenitecin|DRUG: Valproic Acid,ALL,"ADULT, OLDER_ADULT",PHASE1|PHASE2,"H. Lee Moffitt Cancer Center & Research Institute, Tampa, Florida, 33612, United States"
NCT02650492,Immunostimulating Interstitial Laser Thermotherapy in Malignant Melanoma,https://clinicaltrials.gov/study/NCT02650492,NO,Melanoma|Malignant Melanoma,DEVICE: Immunostimulating Interstitial Laser Thermotherapy,ALL,"ADULT, OLDER_ADULT",NA,"Karolinska University Hospital Solna, Stockholm, 17176, Sweden"
NCT00087776,Study of Taxoprexin Injection vs. Dacarbazine in Patients With Metastatic Malignant Melanoma,https://clinicaltrials.gov/study/NCT00087776,NO,Malignant Melanoma,DRUG: Chemotherapy,ALL,"ADULT, OLDER_ADULT",NA,"Luitpold Pharmaceuticals, Inc., Norristown, Pennsylvania, 19403, United States"
NCT00729950,Study of MDX-010 in Subjects With Unresectable Stage III or Stage IV Malignant Melanoma,https://clinicaltrials.gov/study/NCT00729950,NO,Malignant Melanoma,BIOLOGICAL: MDX-010,ALL,"ADULT, OLDER_ADULT",PHASE1,"Arizona Cancer Center, Tucson, Arizona, 85724-5024, United States|USC/Norris Comprehensive Cancer Center, Los Angeles, California, 90033, United States|Piedmont Oncology Specialists, Charlotte, North Carolina, 28207, United States|Providence Portland Medical Center, Portland, Oregon, 97213, United States"
NCT01137006,"An Open-Label, Dose-Escalation Study of IMC-20D7S In Participants With Malignant Melanoma",https://clinicaltrials.gov/study/NCT01137006,YES,Malignant Melanoma,BIOLOGICAL: IMC-20D7S (Cohort 1A)|BIOLOGICAL: IMC-20D7S (Cohort 2A)|BIOLOGICAL: IMC-20D7S (Cohort 3A)|BIOLOGICAL: IMC-20D7S (Cohort 4A)|BIOLOGICAL: IMC-20D7S (Cohort 1B)|BIOLOGICAL: IMC-20D7S (Cohort 2B)|BIOLOGICAL: IMC-20D7S (Cohort 3B),ALL,"ADULT, OLDER_ADULT",PHASE1,"ImClone Investigational Site, Boston, Massachusetts, 02114, United States|ImClone Investigational Site, New York, New York, 10021, United States"
NCT04217382,Pre Transplantation Melanoma,https://clinicaltrials.gov/study/NCT04217382,NO,Malignant Melanoma,OTHER: patient with melanoma pre transplantation,ALL,"ADULT, OLDER_ADULT",,"service de dermatologie - hopital Edouard Herriot, Lyon, Rhone, 69003, France"
NCT00327600,Safety and Efficacy Trial of Imexon Plus DTIC in Advanced Malignant Melanoma,https://clinicaltrials.gov/study/NCT00327600,NO,Malignant Melanoma,DRUG: imexon|DRUG: DTIC,ALL,"CHILD, ADULT, OLDER_ADULT",PHASE1|PHASE2,"Investigational Site 009, Los Angeles, California, 90033, United States|Investigational Site 002, Santa Monica, California, 90404, United States|University of CO Anschutz Cancer Pavilion, Aurora, Colorado, 80010, United States|US Oncology Orlando, Cancer Centers of FL, Ocoee, Florida, 34761, United States|US Oncology Albany, New York Oncology, Albany, New York, 12208, United States|US Oncology Kettering, Kettering, Ohio, 45409, United States|US Oncology Greenville, Cancer Centers of the Carolinas, Greenville, South Carolina, 29615, United States|US Oncology, Tyler Cancer Center, Tyler, Texas, 75702, United States|Investigational Site 012, Salt Lake City, Utah, 84112, United States|US Oncology, Virginia Oncology Assoc, Norfolk, Virginia, 23502, United States|US Oncology Spokane, Cancer Care Northwest, Spokane, Washington, 99218, United States"
NCT01636960,A Study of Pegylated Interferon Alfa-2b (MK-4031) as an Adjuvant Treatment in Japanese Patients With Malignant Melanoma (MK-4031-370),https://clinicaltrials.gov/study/NCT01636960,YES,Malignant Melanoma,BIOLOGICAL: PegIFN alfa-2b,ALL,"ADULT, OLDER_ADULT",PHASE1,
NCT03538314,UV1 Vaccine With Pembrolizumab for Patients With Unresectable or Metastatic Melanoma,https://clinicaltrials.gov/study/NCT03538314,NO,Malignant Melanoma,DRUG: UV1|DRUG: GM-CSF,ALL,"ADULT, OLDER_ADULT",PHASE1,"John Wayne Cancer Center, Santa Monica, California, 90404, United States|University of Iowa Carver College of Medicine, Iowa City, Iowa, 52242, United States|St. Luke's University Health Network, Easton, Pennsylvania, 18045, United States|University of Utah Huntsman Cancer Institute, Salt Lake City, Utah, 84112, United States"
NCT01138410,Study of a DNA Immunotherapy to Treat Melanoma,https://clinicaltrials.gov/study/NCT01138410,NO,Malignant Melanoma,BIOLOGICAL: SCIB1,ALL,"ADULT, OLDER_ADULT",PHASE1|PHASE2,"Department of Medical Oncology, The Royal Surrey County Hospital, Guildford, Surrey, GU2 7XX, United Kingdom|St James' Institute of Oncology, Leeds, LS9 7TF, United Kingdom|Christie Hospital, Manchester, M20 4BX, United Kingdom|Department of Clinical Oncology, City Hospital, Nottingham, NG5 1PB, United Kingdom|Department of Medical Oncology, Southampton General Hospital, Southampton, SO16 6YD, United Kingdom"
NCT01124734,High Dose Interleukin-2 Followed by Intermittent Low Dose Temozolomide in Patients With Melanoma,https://clinicaltrials.gov/study/NCT01124734,YES,Malignant Melanoma,DRUG: Interleukin-2|DRUG: Temozolomide,ALL,"ADULT, OLDER_ADULT",PHASE2,"Penn State Milton S. Hershey Medical Center, Hershey, Pennsylvania, 17033, United States"
NCT01455259,Phase I/IIa AdCD40L Immunogene Therapy for Malignant Melanoma and Other Solid Tumors,https://clinicaltrials.gov/study/NCT01455259,NO,Malignant Melanoma,BIOLOGICAL: AdCD40L,ALL,"ADULT, OLDER_ADULT",PHASE1|PHASE2,"Uppsala University Hospital, Uppsala, 75185, Sweden"
NCT00963664,Evaluation of Interferon-Lovastatin Therapy for Malignant Melanoma,https://clinicaltrials.gov/study/NCT00963664,NO,Melanoma|Malignant Melanoma,DRUG: lovastatin|DRUG: interferon alfa-2b,ALL,"ADULT, OLDER_ADULT",PHASE2,"NeoPlas Innovation, Nashville, Tennessee, 37027, United States"
NCT01696045,"Phase 2 Study of Ipilimumab in Children and Adolescents (12 to < 18 Years) With Previously Treated or Untreated, Unresectable Stage III or Stage lV Malignant Melanoma",https://clinicaltrials.gov/study/NCT01696045,YES,Malignant Melanoma,BIOLOGICAL: Ipilimumab,ALL,CHILD,PHASE2,"Phoenix Children'S Hospital, Phoenix, Arizona, 85016, United States|Childrens Hospital Of La, Los Angeles, California, 90027, United States|Children'S Hospital Of Orange County, Orange, California, 92868, United States|Children'S Hospital Colorado, Aurora, Colorado, 80045, United States|H. Lee Moffitt Cancer Center & Research Institute, Tampa, Florida, 33612, United States|James Whitcomb Riley Hospital For Children, Indianapolis, Indiana, 46202, United States|Dana-Farber Cancer Institute, Boston, Massachusetts, 02215, United States|Mayo Clinic, Rochester, Minnesota, 55905, United States|Memorial Sloan Kettering Cancer Center, New York, New York, 10065, United States|University Of Pittsburgh Medical Center Cancer Center, Pittsburgh, Pennsylvania, 15232, United States|St. Jude Children'S Research Hospital, Memphis, Tennessee, 38105, United States|The University Of Texas Md Anderson Cancer Center, Houston, Texas, 77030, United States|Primary Children'S Medical Center, Salt Lake City, Utah, 84113, United States|University Of Utah, Salt Lake City, Utah, 84113, United States|Local Institution, Gent, 9000, Belgium|Local Institution, Copenhagen, 2100, Denmark|Local Institution, Lyon, 69008, France|Local Institution, Marseille Cedex 5, 13385, France|Local Institution, Nantes Cedex 1, 44093, France|Local Institution, Villejuif Cedex, 94805, France|Local Institution, Dortmund, 44137, Germany|Local Institution, Erlangen, 91054, Germany|Local Institution, Hamburg, 20246, Germany|Local Institution, M?nster, 48149, Germany|Local Institution, Munster, 48149, Germany|Local Institution, Mexico, D.F, 02990, Mexico|Local Institution, Df, Distrito Federal, 06720, Mexico|Local Institution, Leon, Guanajato, Guanajuato, 37000, Mexico|Local Institution, Esplugues de Llobregat- Barcelona, 08950, Spain|Local Institution, Bristol, Avon, BS2 8BJ, United Kingdom|Local Institution, Newcastle, Northumberland, NE1 4LP, United Kingdom|Local Institution, Sutton, Surrey, SM2 5PT, United Kingdom"
NCT01264081,Lapatinib in Stage IV Melanoma With ERBB4 Mutations,https://clinicaltrials.gov/study/NCT01264081,YES,Malignant Melanoma,DRUG: Lapatinib,ALL,"ADULT, OLDER_ADULT",PHASE2,"National Institutes of Health Clinical Center, 9000 Rockville Pike, Bethesda, Maryland, 20892, United States"
NCT00145041,Pharmacokinetic Study of Liposomal Vincristine in Patients With Malignant Melanoma & Hepatic Dysfunction,https://clinicaltrials.gov/study/NCT00145041,YES,Malignant Melanoma,DRUG: Vincristine Sulfate Liposomes Injection,ALL,"ADULT, OLDER_ADULT",PHASE1,"University of Texas M.D. Anderson Cancer Center, Houston, Texas, 77030, United States"
NCT03034395,Study of 1cm Versus 2cm Margins for the Surgical Treatment of cT2N0M0 Melanoma,https://clinicaltrials.gov/study/NCT03034395,NO,Malignant Melanoma,PROCEDURE: Wide Local Excision,ALL,"ADULT, OLDER_ADULT",NA,"University of Kansas Medical Center, Kansas City, Kansas, 66160, United States"
NCT02537600,Vemurafenib and Cobimetinib Combination in BRAF Mutated Melanoma With Brain Metastasis,https://clinicaltrials.gov/study/NCT02537600,NO,Malignant Melanoma,DRUG: Cobimetinib + Vemurafenib combination treatment,ALL,"ADULT, OLDER_ADULT",PHASE2,"CHU de Bordeaux, Bordeaux, 33000, France|CHU Ambroise Paré, Boulogne, 92104, France|CHU Brest - Hôpital Morvan, Brest, France|CHU Caen - Hôpital Clémenceau, Caen, 14033, France|Hôpital Henri Mondor, Creteil, 94010, France|CHU de Dijon, Dijon, France|CHU Albert Michallon, Grenoble, 38014, France|Centre Hospitalier du Mans, Le Mans, 72037, France|CHRU Lille, Lille, 59037, France|Centre Hospitalier Lyon Sud, Lyon, 69495, France|CHU de Nantes, Nantes, 44093, France|Groupe Hospitalier l'Archet, Nice, 06202, France|Hôîtal St louis, Paris, 75010, France|Hôpital Cochin, Paris, 75014, France|Hôpital Bichat, Paris, 75018, France|Centre Eugène Marquis, Rennes, 35042, France|CHU Tours, Tours, 37044, France"
NCT01024231,Dose-escalation Study of Combination BMS-936558 (MDX-1106) and Ipilimumab in Subjects With Unresectable Stage III or Stage IV Malignant Melanoma,https://clinicaltrials.gov/study/NCT01024231,YES,Malignant Melanoma,DRUG: BMS-936558 (MDX1106-04)|DRUG: Ipilimumab,ALL,"ADULT, OLDER_ADULT",PHASE1,"Yale University School Of Medicine, New Haven, Connecticut, 06520, United States|Medstar Georgetown-Lombardi Comprehensive Cancer Center, Washington, District of Columbia, 20007, United States|Memorial Sloan Kettering Nassau, New York, New York, 11065, United States|Hillman Cancer Research Pavilion, Pittsburgh, Pennsylvania, 15232, United States"
NCT02223884,A Study to Evaluate the Efficacy of Docetaxel and Carboplatin in Metastatic Malignant Melanoma Failed First-Line Dacabazine or Temozolomide Contained Therapy,https://clinicaltrials.gov/study/NCT02223884,NO,Malignant Melanoma,DRUG: docetaxel 35mg/m2|DRUG: Carboplatin AUC3,ALL,"ADULT, OLDER_ADULT",PHASE2,"Severance Hospital, Seoul, 120-752, Korea, Republic of"
NCT00733798,A Safety and Efficacy Study of Intravenous 131I-TM601 in Adult Patients With Malignant Melanoma,https://clinicaltrials.gov/study/NCT00733798,NO,Melanoma|Malignant Melanoma|Metastatic Melanoma,DRUG: 131I-TM601,ALL,"ADULT, OLDER_ADULT",PHASE1|PHASE2,"Lacks Cancer Center, Grand Rapids, Michigan, 49503, United States|New York University School of Medicine, New York, New York, 10016, United States|Mary Crowley Cancer Center, Dallas, Texas, 75246, United States"
NCT02673970,Biomarkers for the Activity of Immune Checkpoint Inhibitor Therapy in Patients With Advanced Melanoma,https://clinicaltrials.gov/study/NCT02673970,NO,Malignant Melanoma,,ALL,"ADULT, OLDER_ADULT",,"UZ Brussel, Jette, Brabant, 1090, Belgium|UZ Brussel, Jette, Brussels, 1090, Belgium"
NCT05089370,Oral Decitabine/Cedazuridine (DEC-C) in Combination With Nivolumab for Patients With Mucosal Melanoma,https://clinicaltrials.gov/study/NCT05089370,NO,Malignant Melanoma,COMBINATION_PRODUCT: Oral Decitabine/Cedazuridine (DEC-C) in Combination with Nivolumab,ALL,"ADULT, OLDER_ADULT",PHASE1|PHASE2,"University of Colorado Hospital, Aurora, Colorado, 80045, United States"
NCT01543464,Peptide Vaccine and Temozolomide for Metastatic Melanoma Patients,https://clinicaltrials.gov/study/NCT01543464,NO,Malignant Melanoma,DRUG: Chemotherapy: Temozolomide,ALL,"ADULT, OLDER_ADULT",PHASE2,"Trine Zeeberg Iversen, Brønshøj, Copenhagen, 2700, Denmark"
NCT05675709,Enhancing Skin Cancer Early Detection and Treatment in Primary Care,https://clinicaltrials.gov/study/NCT05675709,NO,Cutaneous Melanoma,BEHAVIORAL: Training and Education,ALL,"ADULT, OLDER_ADULT",NA,"OHSU Knight Cancer Institute, Portland, Oregon, 97239, United States"
NCT00539591,Phase II Study Incorporating Pegylated Interferon In the Treatment For Children With High-Risk Melanoma,https://clinicaltrials.gov/study/NCT00539591,YES,Malignant Melanoma,DRUG: Peginterferon alfa-2b|DRUG: Temozolomide|DRUG: Recombinant interferon alfa-2b,ALL,"CHILD, ADULT",PHASE2,"Rady Children's Hospital, San Diego, California, 92123, United States|St. Jude Children's Research Hospital, Memphis, Tennessee, 38105, United States|The Children's Cancer Hospital at UT M.D. Anderson Cancer Center, Houston, Texas, 77030, United States"
NCT02889861,IMCgp100-401 Rollover Study,https://clinicaltrials.gov/study/NCT02889861,YES,Malignant Melanoma,DRUG: IMCgp100,ALL,"ADULT, OLDER_ADULT",PHASE2,"Memorial Slone Kettering Cancer Center, New York, New York, 10065, United States|Dept of Oncology & Haematology, Churchill Hospital, Oxford, Oxfordshire, OX3 7LJ, United Kingdom|Dept of Medical Oncology, Beatson West of Scotland Cancer Centre, Glasgow, G12 OYN, United Kingdom"
NCT01898039,Modified Melanoma Vaccine for High Risk or Low Residual Disease Patients,https://clinicaltrials.gov/study/NCT01898039,NO,Malignant Melanoma,BIOLOGICAL: A2/4-1BBL melanoma vaccine|PROCEDURE: DNP sensititzation|DRUG: Cyclophosphamide,ALL,"CHILD, ADULT, OLDER_ADULT",PHASE1|PHASE2,"Sharett Institute of Oncology, Hadassah Medical Organization, Jerusalem, 91120, Israel"
NCT03448666,ECT-Pembrolizumab in Patients With Unresectable Melanoma With Superficial or Superficial and Visceral Metastases,https://clinicaltrials.gov/study/NCT03448666,NO,Malignant Melanoma,COMBINATION_PRODUCT: Pembrolizumab,ALL,"ADULT, OLDER_ADULT",PHASE2,"IEO Istituto Europeo di Oncologia, Milan, 20141, Italy"
NCT02071940,PLX3397 KIT in Acral aNd mucOsal Melanoma,https://clinicaltrials.gov/study/NCT02071940,NO,Malignant Melanoma,DRUG: PLX3397,ALL,"ADULT, OLDER_ADULT",PHASE2,"The Christie NHS Foundation Trust, Manchester, Greater Manchester, M20 4BX, United Kingdom|The Beatson West of Scotland Cancer Centre, Glasgow, Scotland, G12 OXH, United Kingdom|Abertawe Bro Morgannwg University Health Board, Singleton Hospital, Swansea, Wales, SA2 8QA, United Kingdom|St James' University Hospital, Leeds, Yorkshire, LS9 7TF, United Kingdom|Cancer Clinical Trials Centre- Weston Park Hospital, Sheffield, Yorkshire, S10 2SJ, United Kingdom|Cambridge University Hospitals NHS FT - Addenbrookes Hospital, Cambridge, CB2 0QQ, United Kingdom|The Royal Marsden NHS Foundation Trust, London, SW3 6JJ, United Kingdom|Oxford University Hospitals NHS Trust- Churchill Hospital, Oxford, OX3 7LE, United Kingdom"
NCT03563729,Melanoma Metastasized to the Brain and Steroids,https://clinicaltrials.gov/study/NCT03563729,NO,Malignant Melanoma,DRUG: Pembrolizumab Injection [Keytruda]|DRUG: Ipilimumab Injection [Yervoy]|DRUG: Nivolumab Injection [Opdivo]|DRUG: Encorafenib|DRUG: Binimetinib|DRUG: Dabrafenib|DRUG: Trametinib,ALL,"ADULT, OLDER_ADULT",PHASE2,"Herlev Universityhospital, Herlev, Hovedstaden, 2730, Denmark|Aarhus Universityhospital, Aarhus, Midt, 8000, Denmark|Odense Universityhospital, Odense, Syd, 5000, Denmark"
NCT00911443,"Thymosin Alpha 1, Interferon Alpha, or Both, in Combination With Dacarbazine in Patients With Malignant Melanoma",https://clinicaltrials.gov/study/NCT00911443,YES,Malignant Melanoma,BIOLOGICAL: Dacarbazine + Interferon alpha + Thymosin-alpha-1 1.6 mg|BIOLOGICAL: Dacarbazine + Interferon alpha + Thymosin-alpha-1 3.2 mg|BIOLOGICAL: Dacarbazine + Interferon alpha + Thymosin-alpha-1 6.4 mg|BIOLOGICAL: Dacarbazine + Thymosin-alpha-1 3.2 mg|DRUG: Dacarbazine + Interferon alpha,ALL,"ADULT, OLDER_ADULT",PHASE2,"CHU de Grenoble Hopital Albert Michallon Service de Dermatologie, La Tronche, 38043, France|CHU de Limoges Hopital Dupuytren Service de Dermatologie, Limoges, 87042, France|Hopital Saint-Eloi Service de Dermatologie, Montpellier, 34295, France|Centre Eugene Marquis Departement d'Oncologie Medicale, Rennes, 35042, France|Hopital Purpan Service de Dermatologie, Toulouse, 31059, France|Klinik fur Dermatologie und Allergologie der RWTH Aachen, Aachen, 52074, Germany|Klinik fur Dermatologie, Venerologie und Allergologie des Campus Charitè Mitte, Berlin, 10117, Germany|Elbeklinikec Buxtehude Dermatologische Zentrum Abteilung fur Dermato-Onkologie, Buxtehude, 21614, Germany|Zentrum fur Dermatologie und Veneralogie Klinik der Johann-Wolfgang-Goethe-Universitat, Frankfurt, 60590, Germany|Klinikum Hannover, Hautklinik Linden, Hannover, D-30449, Germany|Universitatsklinikum Schlewig-Holstein Klinik fur Dermatologie, Veneralogie und Allergologie Universitats-Hautklinik Kiel, Kiel, 24105, Germany|Universitatsklinik fur Dermatologie und Venerologie Otto-von-Guericke-Universitat Magdeburg, Magdeburg, 39120, Germany|Dermatologische Klinik der Universitat Tubingen, Tubingen, 72076, Germany|Orszagos Bor-es Nemikortani Intezet, Budapest, H-1085, Hungary|Orszagos Onkologiai Intezet Borgyogyaszat, Budapest, H-1122, Hungary|Petz Aladar Megyei Korhaz, Borgyogyaszat, Gyor, H-9024, Hungary|Miskolc Megyei Korhaz Borgyogyaszat, Miskolc, H-3501, Hungary|Pecsi Egyetem Borgyogyaszati Klinika, Pecs, H-7600, Hungary|Szegedi Egyetem Borgyogyaszati Klinika, Szeged, H-6701, Hungary|Ospedale SS Trinità Oncologia, Sora, Frosinone, 03039, Italy|Ospedale San Vincenzo U.O. Oncologia Medica, Taormina, Messina, 98039, Italy|UO Complessa Aziendale Nettuno/Albano/Frascati Day-Hospital di Oncologia Ospedale S. Giuseppe, Albano Laziale, Roma, 00041, Italy|Ospedale PF Calvi Dipartimento di Oncologia, Noale, Venezia, 30033, Italy|ASL 1 Servizio di Oncologia, Agrigento, Italy|Azienda Ospedaliera S. Elia, UO di Oncologia, Caltanissetta, 93100, Italy|Azienda Ospedaliera Garibaldi, UO Oncologia Medica, Catania, 95126, Italy|Università ""G. D'Annunzio"" Facoltà di Medicina e Chirurgia, Clinica Dermatologica, Chieti, 66100, Italy|Azienda Ospedaliera Umberto I° UO Servizio di Oncologia e Chemioterapia, Enna, 94100, Italy|Università di Firenze Dipartimento di Scienze Dermatologiche, Firenze, 50121, Italy|Ospedale Pierantoni, Divisione Oncologia Medica, Forli, 47100, Italy|Istituto NazionaleRicerca sul Cancro, Dipartimento di Oncologia Medica 1, Genova, 16132, Italy|Istituto Europeo di Oncologia, Divisione di Chirurgia Generale, Milano, 20141, Italy|Casa di Cura San Pio X, UO Oncologia Medica, Milano, 20159, Italy|Ospedale Civile, UO di Oncologia, Ragusa, 97100, Italy|Azienda Ospedaliera Bianchi-Melacrino-Morelli, Oncologia Medica, Reggio Calabria, 89100, Italy|Università di Roma ""Tor Vergata"" Oncologia Complementare, Dipartimento di Chirurgia, Roma, 00133, Italy|IFO Polo Oncologico Ist. Regina Elena, Divisione di Oncologia Medica A, Roma, 00144, Italy|Ospedale Sandro Pertini, Oncologia Medica, Roma, 00157, Italy|Università ""La Sapienza"" Dipartimento di Malattie Cutanee-Veneree e Chirurgia Plastica Ricostruttiva, Roma, 00161, Italy|Istituto Dermopatico dell'Immacolata, Dipartimento di Immunodermatologia, Roma, 00167, Italy|Policlinico ""Le Scotte"" Dipartimento di Medicina Clinica, Scienze Immunologiche Applicate, Divisione di Dermatologia, Siena, 53100, Italy|U.O. Complessa, Immunoterapia Oncologica, Policlinico ""Le Scotte"", Siena, 53100, Italy|Ospedale Umberto I°, Divisione di Oncologia Medica, Siracusa, 96100, Italy|Ospedale Bel Colle UO di Oncologia, Viterbo, 01100, Italy|Katedra i Klinika Onkologii i Radioterapii Akademia Medyczna, Gdansk, 80-211, Poland|Instytut Onkologii im. Marii Sklodowskiej-Curie, Oddzial w Krakowie, Klinika Chemioterapii, Krakow, 31-115, Poland|Wojewodzki Szpital Specjalistyczny im. M. Kopernika, Klinika Chemioterapii Oncologicznej, Lodz, 93-509, Poland|Samodzielny Publiczny Szpital Kliniczny nr 1, Klinika Chirurgii Onkologicznej, Lublin, 20-081, Poland|Wielkopolskie Centrum Onkologii, Zaklad Immunologii Nowotworow Katedry Onkologii AM, Poznan, 61-868, Poland|Oddzial Chemioterapii, Szczecin, 71-730, Poland|Klinika Onkologii Centralnego Szpitala WAM, Warszawa, Poland|Dolnoslakie Centrum Transplantacji Komorkowych z Krajowym Bankiem Dawcow Szpiku, Wroclaw, 53-439, Poland|Instituto Portugues de Oncologia de Francisco Gentil, Centro Regional de Oncologia de Lisboa S.A., Servicio de Medicina Oncologica 1, Pavilhao C, Lisboa, 1099-023, Portugal|Instituto Portugues de Oncologia de Francisco Gentil, Centro Regional de Oncologia do Porto S.A., Servicio de Medicina Oncologica, Piso 3, Porto, 4200, Portugal|Instituto Catalan Oncologico, Servicio de Oncologia, L'hospitalet de Llobregat, Barcelona, 08907, Spain|Hosp. Univ. de Canarias Servicio de Oncologia Medica, La Laguna, Santa Cruz de Tenerife, 38320, Spain|Hosp. Clinic i Provincial Servicio de Oncologia, Barcelona, 08036, Spain|Hosp. Universitario de Jaen Servicio de Oncologia, Jaen, 23007, Spain|Hosp. Clinico San Carlos Servicio de Oncologia, Pabellon B, Ala Sur-Sotano, Madrid, 28040, Spain|Hosp. Virgen de la Victoria de Malaga Servicio de Oncologia 1a planta Campus Universitario de Teatinos, Malaga, 29010, Spain|Hosp. Virgen del Rocio Servicio de Oncologia, Planta Baja - Centro de Diagnostico, Sevilla, 41013, Spain|Instituto Valenciano Oncologico, Valencia, 46009, Spain|Hospital General Universitario de Valencia Unidad de Oncologia Medica, Valencia, 46014, Spain|Zentrum fur Onkologie Hematologie und Transfusionsmedizin am Kantonsspital Aarau, Aarau, CH-5001, Switzerland"
