NCT Number,Study Title,Study URL,Study Results,Conditions,Interventions,Sex,Age,Phases,Locations
NCT01689519,A Study Comparing Vemurafenib Versus Vemurafenib Plus Cobimetinib in Participants With Metastatic Melanoma,https://clinicaltrials.gov/study/NCT01689519,YES,Malignant Melanoma,DRUG: Placebo|DRUG: Vemurafenib|DRUG: Cobimetinib,ALL,"ADULT, OLDER_ADULT",PHASE3,"University of Alabama at Birmingham, Birmingham, Alabama, 35233, United States|The Angeles Clinic and Research Institute - W LA Office, Los Angeles, California, 90025, United States|University of California Davis Health System, Sacramento, California, 95817, United States|Sutter Pacific Medical Foundation, Santa Rosa, California, 95403, United States|University Of Colorado, Aurora, Colorado, 80045, United States|Florida Cancer Specialists - Broadway, Fort Myers, Florida, 33901, United States|Mount Sinai Medical Center, Miami Beach, Florida, 33140, United States|Orlando Health Inc., Orlando, Florida, 32806, United States|Northwestern Center For Clinical Research, Chicago, Illinois, 60611, United States|Uni of Kansas Medical Center; Dept of Neurology, Kansas City, Kansas, 66160-7314, United States|U of L - Physicians Pulmonology; Dept of Neuroradiology and Dept of Diagnostic Radiology, Louisville, Kentucky, 40202, United States|Washington University School of Medicine; Dept of Medicine/Div of Medical Oncology, Saint Louis, Missouri, 63108, United States|Dartmouth-Hitchcock Medical Center; Department of Medicine, Lebanon, New Hampshire, 03756, United States|Novant Health Oncology Specialists, Winston-Salem, North Carolina, 27103, United States|University Hospitals of Cleveland, Cleveland, Ohio, 44106, United States|St. Luke's University Health network, Bethlehem, Pennsylvania, 18015, United States|Thomas Jefferson University Hospital, Philadelphia, Pennsylvania, 19107, United States|University of Pittsburgh, Pittsburgh, Pennsylvania, 15261, United States|Rhode Island Hospital; Investigational Services, Providence, Rhode Island, 2903, United States|Vanderbilt University Medical Center, Nashville, Tennessee, 37232, United States|Chris O'Brien Lifehouse, Camperdown, New South Wales, 2050, Australia|Lake Macquarie Private Hospital, Gateshead, New South Wales, 2290, Australia|Lismore Base Hospital; Cancer Care & Haematology Unit, Lismore, New South Wales, 2480, Australia|Melanoma Institute Australia, North Sydney, New South Wales, 2060, Australia|Princess Alexandra Hospital, Woolloongabba, New South Wales, 2050, Australia|Royal Darwin Hospital, Casuarina, Northern Territory, 0811, Australia|Greenslopes Private Hospital, Greenslopes, Queensland, 4120, Australia|Royal Brisbane and Women's Hospital, Herston, Queensland, 4029, Australia|Royal Adelaide Hospital; Hepatology, Adelaide, South Australia, 5000, Australia|Ashford Cancer Centre, Ashford SA, South Australia, 5035, Australia|Royal Hobart Hospital, Hobart, Tasmania, 7000, Australia|Launceston General Hospital; Gastroenterology Research, Launceston, Tasmania, 7250, Australia|Peninsula and South Eastern Haematology and Oncology Group, Frankston, Victoria, 3199, Australia|Austin Hospital, Heidelberg, Victoria, 3084, Australia|Peter MacCallum Cancer Centre-East Melbourne, Melbourne, Victoria, 3000, Australia|The Alfred Hospital, Prahan, Victoria, 3181, Australia|Fiona Stanley Hospital, Murdoch, Western Australia, 6150, Australia|Ordensklinikum Linz Elisabethinen, Linz, 4020, Austria|Landesklinikum St. Pölten, St. Pölten, 3100, Austria|Medizinische Universität Wien, Wien, 1090, Austria|Institut Jules Bordet; Department of Medical Oncology, Bruxelles, 1000, Belgium|Cliniques Universitaires St-Luc, Bruxelles, 1200, Belgium|UZ Antwerpen, Edegem, 2650, Belgium|Jessa Zkh (Campus Virga Jesse), Hasselt, 3500, Belgium|CHU Sart-Tilman, Liège, 4000, Belgium|AZ Delta (Campus Rumbeke), Roeselare, 8800, Belgium|BC Cancer Agency Vancouver Island Cancer Centre, Victoria, British Columbia, V8R 6V5, Canada|Juravinski Cancer Clinic; Department of Oncology, Hamilton, Ontario, L8V 5C2, Canada|The Ottawa Hospital Cancer Center; General Campus, Ottawa, Ontario, K1H 1C4, Canada|Toronto Sunnybrook Hospital, Toronto, Ontario, M4N 3M5, Canada|Princess Margaret Hospital; Department of Med Oncology, Toronto, Ontario, M5G 2M9, Canada|London Health Sciences Centre · Victoria Hospital;Department of Pediatrics, London, Quebec, N6A 4G5, Canada|McGill University Health Centre/Glen Site / Royal Victoria Hospital, Montréal, Quebec, H2W 1S6, Canada|Masarykuv onkologicky ustav, Brno, 656 53, Czechia|Fakultni nemocnice Hradec Kralove, Hradec Kralove, 500 05, Czechia|Fakultní nemocnice Olomouc, Olomouc, 775 20, Czechia|Fakultni nemocnice Ostrava, Ostrava - Poruba, 708 52, Czechia|Multiscan s.r.o., Pardubice, 532 03, Czechia|Nemocnice Na Bulovce, Prague, 180 01, Czechia|Vseobecna fakultni nemocnice v Praze, Praha 2, 128 08, Czechia|Fakultni nemocnice Kralovske Vinohrady, Praha, 100 34, Czechia|Fakultni nemocnice Motol; Neurologicka klinika, Praha, 150 06, Czechia|Groupe Hospitalier Saint André - Hôpital Saint André, Bordeaux, 33075, France|Hôpital Ambroise Paré - Boulogne-Billancourt; Respiratory, Boulogne Billancourt, 92104, France|CHU Clermont Ferrand - Hôpital d'Estaing, Clermont Ferrand cedex 1, 63003, France|CHU de Dijon - Hopital le Bocage, Dijon, 21000, France|Centre Hospitalier Universitaire de Grenoble - Albert Michallon, La Tronche, 38700, France|Hopital Claude Huriez - CHU Lille, Lille, 59037, France|Hopital de la Timone, Marseille, 13005, France|Hopital Saint Eloi, Montpellier, 34295, France|CHU NANTES - Hôtel Dieu; Pharmacy, Nantes, 44093, France|CHU Nice - Hopital de l'Archet 2, Nice, 06202, France|Centre Hospitalier Lyon Sud, Pierre Benite, 69495, France|Hopital Robert Debre; DERMATOLOGIE, Reims, 51092, France|Centre Eugene Marquis; Service d'oncologie, Rennes, 35042, France|St. Josef-Hospital; Studienambulanz, Bochum, 44791, Germany|Elbekliniken Buxtehude GmbH, Buxtehude, 21614, Germany|Universitätsklinikum ""Carl Gustav Carus"" der Technischen Universität Dresden, Dresden, 01307, Germany|Helios Klinikum Erfurt, Erfurt, 99089, Germany|Universitätsklinikum Essen, Essen, 45147, Germany|Universitaetsklinikum Freiburg, Freiburg, 79106, Germany|SRH Wald-Klinikum Gera; Klinik für Hautkrankheiten und Allergologie, Gera, 07548, Germany|Universitätsmedizin Göttingen, Göttingen, 37075, Germany|Universitätsklinikum Hamburg-Eppendorf, Hamburg, 20246, Germany|Medizinische Hochschule Hannover, Hannover, 30625, Germany|Universitätsklinikum Heidelberg, Heidelberg, 69120, Germany|Universitaetsklinikum Schleswig-Holstein - Campus Kiel; Klinik fuer Allgemeine Innere Medizin, Kiel, 24105, Germany|Universitaetsklinikum Koeln; Hematology/Oncology, Koeln, 50937, Germany|Universitaetsmedizin der Johannes Gutenberg-Universitaet Mainz, Mainz, 55101, Germany|Klinikum Mannheim GmbH Universitätsklinikum, Mannheim, 68167, Germany|Fachklinik Hornheide, Muenster, 48157, Germany|Klinikum der Ludwigs-Maximilians-Universitaet Muenchen, München, 80337, Germany|Universitaetsklinikum Regensburg, Regensburg, 93053, Germany|Universitätsklinikum Tübingen, Tuebingen, 72076, Germany|Universitätsklinikum Wurzburg, Würzburg, 97080, Germany|Orszagos Onkologiai Intezet, Budapest, 1122, Hungary|Bekes Megyei Kozponti Korhaz Pandy Kalman Tagkorhaza, Gyula, 5700, Hungary|Somogy Megyei Kaposi Mor Oktato Korhaz, Pecs, 7624, Hungary|Szegedi Tud.Egyetem Szent-Gyorgyi Albert Klin.Kozp., Szeged, 6720, Hungary|Soroka Medical Center; Oncology Dept, Beer Sheva, 8410100, Israel|Rambam Health Care Campus, Haifa, 3109600, Israel|HADASSAH UNIVERSITY HOSPITAL, EIN KAREM; Oncology, Jerusalem, 9112000, Israel|Rabin Medical Center-Beilinson Campus;Hematology-Oncology, Petach Tikva, 4941492, Israel|Chaim Sheba Medical Center, Ramat Gan, 5265601, Israel|Tel Aviv Sourasky MC, Dana children's hospital;Oncology Division, Tel Aviv, 6423906, Israel|Istituto Nazionale Tumori Fondazione G. Pascale, Napoli, Campania, 80131, Italy|Istituto Scientifico Romagnolo Per Lo Studio e La Cura Dei Tumori, Meldola, Emilia-Romagna, 47014, Italy|A.O.U. Policlinico di Modena, Modena, Emilia-Romagna, 40124, Italy|Istituto Nazionale Tumori Regina Elena IRCCS, Roma, Lazio, 00144, Italy|Istituto Nazionale per la Ricerca sul Cancro di Genova, Genova, Liguria, 16132, Italy|Azienda Socio Sanitaria Territoriale Papa Giovanni XXIII (Presidio Papa Giovanni XXIII), Bergamo, Lombardia, 24127, Italy|Asst Degli Spedali Civili Di Brescia, Brescia, Lombardia, 25100, Italy|Fondazione IRCCS Istituto Nazionale dei Tumori, Milano, Lombardia, 20133, Italy|Istituto Tumori Giovanni Paolo II IRCSS; Ospedale Oncologico Bari, Bari, Puglia, 70126, Italy|A.O.U. Senese Policlinico Santa Maria Alle Scotte, Siena, Toscana, 53100, Italy|IOV - Istituto Oncologico Veneto IRCCS, Padova, Veneto, 35128, Italy|Amsterdam UMC Location VUMC, Amsterdam, 1081 HV, Netherlands|Leids Universitair Medisch Centrum; Cardiology, Leiden, 2333 ZA, Netherlands|Maastricht University Medical Center, Maastricht, 6229 HX, Netherlands|Auckland City Hospital, Auckland, 1023, New Zealand|Waikato Hospital, Hamilton, 3248, New Zealand|Radiumhospitalet, Oslo, 0379, Norway|TSBHI Altai Territorial oncological dispensary, Barnaul, 656045, Russian Federation|FSBSI ""N. N. Blokhin Russian Cancer Research Center"", Moscow, 115478, Russian Federation|Moscow city oncology hospital #62 of Moscow Healthcare Department, Moscow, 143423, Russian Federation|BHI of Omsk region Clinical Oncology Dispensary, Omsk, 644013, Russian Federation|Pyatigorsky Oncologic Dispensary, Pyatigorsk, 357524, Russian Federation|Complexo Hospitalario Universitario de Santiago, Santiago de Compostela, LA Coruña, 15706, Spain|Clinica Universitaria de Navarra, Pamplona, Navarra, 31008, Spain|Hospital Universitario Virgen Macarena, Seville, Sevilla, 41071, Spain|Hospital Clínic i Provincial de Barcelona, Barcelona, 08036, Spain|MD Anderson Cancer Center, Madrid, 28033, Spain|Hospital Universitario 12 de Octubre, Madrid, 28041, Spain|Hospital General Universitario de Valencia, Valencia, 46014, Spain|Hospital Universitario Miguel Servet, Zaragoza, 50009, Spain|Länssjukhuset Ryhov, Jönköping, 551 85, Sweden|Skånes Universitetssjukhus, Lund, 221 85, Sweden|Sahlgrenska Sjukhuset, Mölnlycke, 435 33, Sweden|Akademiska Sjukhuset, Uppsala, 751 85, Sweden|Inselspital-Universitaetsspital Bern, Bern, 3010, Switzerland|Kantonsspital Graubuenden, Chur, 7000, Switzerland|Bristol Haematology and Oncology Centre, Bristol, BS2 8ED, United Kingdom|Addenbrooke's Hospital, Cambridge, CB2 0QQ, United Kingdom|Velindre Cancer Centre, Cardiff, CF14 2TL, United Kingdom|Western General Hospital, Edinburgh, EH4 2XU, United Kingdom|Beatson West of Scotland Cancer Centre, Glasgow, G12 0YN, United Kingdom|The Clatterbridge Cancer Centre NHS Foundation Trust, Liverpool, L7 8YA, United Kingdom|Barts and the London NHS Trust., London, EC1A 7BE, United Kingdom|St George's Hospital; Courtyard Clinic, London, SW17 0QT, United Kingdom|Royal Marsden Hospital - Fulham, London, SW3 6JJ, United Kingdom|Royal Marsden Hospital - London, London, SW3 6JJ, United Kingdom|Freeman Hospital, Newcastle upon Tyne, NE7 7DN, United Kingdom|Nottingham University Hospitals; QMC Campus, Nottingham, NG7 2UH, United Kingdom|Southampton General Hospital, Southampton, SO16 6YD, United Kingdom|Royal Cornwall Hospital, Truro, TR1 3LQ, United Kingdom|New Cross Hospital, Wolverhampton, WV10 0QP, United Kingdom"
NCT02902029,Evaluating the Efficacy and Safety of a Sequencing Schedule of Cobimetinib Plus Vemurafenib Followed by Immunotherapy With an Anti- PD-L1 Antibody in Patients With Unresectable or Metastatic BRAF V600 Mutant Melanoma,https://clinicaltrials.gov/study/NCT02902029,NO,Malignant Melanoma,DRUG: Vemurafenib|DRUG: Cobimetinib|DRUG: Atezolizumab,ALL,"ADULT, OLDER_ADULT",PHASE2,"Hôpital Ambroise-Paré, Boulogne-Billancourt, 92104, France|Hospital Claude Huriez, Lille, 59000, France|Hôpital de la Timone, Marseille, 13885, France|CHU de Nantes, Nantes, 44093, France|Centre Hospitalier Lyon Sud, Pierre-Bénite, 69310, France|SLK-Kliniken Heilbronn GmbH, Heilbronn, Baden-Wuerttemberg, 74078, Germany|University Hospital Mannheim, Clinic for Dermatology, Mannheim, Baden-Wuerttemberg, 68167, Germany|National Centre for Tumour Diseases (NCT), Heidelberg, BW, 69120, Germany|University Hospital Essen, Department of Dermatology, Skin Cancer Center, Essen, North Rhine-Westphalia, 45122, Germany|HELIOS Klinikum Erfurt, Erfurt, Thuringia, 99089, Germany|Charité-Universitätsmedizin Berlin, Berlin, 10117, Germany|Elbe Kliniken Stade - Buxtehude, Buxtehude, 21614, Germany|Universitätsklinik Dresden, Dresden, 01307, Germany|Medizinische Hochschule Hannover, Hannover, 30625, Germany|Universitätsklinikum des Saarlandes, Homburg/Saar, 66421, Germany|Universitäts-Hautklinik Kiel, Kiel, 24105, Germany|Universitätsklinikum Köln, Köln, 50937, Germany|Universitätsklinikum Leipzig, Leipzig, 04103, Germany|Gesellschaft für Klinische Forschung Ludwigshafen mbH, Ludwigshafen, 67063, Germany|Universitätsklinikum Schleswig-Holstein, Lübeck, 23538, Germany|Universitätsklinikum Mainz, Mainz, 55131, Germany|Johannes Wesling Klinikum Minden, Minden, 32429, Germany|Klinikum der Universität München, München, 80337, Germany|Universitätsklinikum Tübingen, Tübingen, 72076, Germany|Uniklinikum Würzburg, Würzburg, 97080, Germany|""LAIKO"" General Hospital of Athens, Athens, 11527, Greece|Military Medical Academy, Belgrad, 11000, Serbia"
NCT03820986,Safety and Efficacy Study of Pembrolizumab (MK-3475) Combined With Lenvatinib (MK-7902/E7080) as First-line Intervention in Adults With Advance Melanoma (MK-7902-003/E7080-G000-312/LEAP-003),https://clinicaltrials.gov/study/NCT03820986,YES,Malignant Melanoma,BIOLOGICAL: Pembrolizumab|DRUG: Lenvatinib|DRUG: Placebo for lenvatinib,ALL,"ADULT, OLDER_ADULT",PHASE3,"The Angeles Clinic and Research Institute ( Site 0707), Los Angeles, California, 90025, United States|UCSF Helen Diller Family Comprehensive Cancer Center ( Site 0704), San Francisco, California, 30322, United States|California Pacific Medical Center Research Institute ( Site 0705), San Francisco, California, 94115, United States|John Wayne Cancer Institute ( Site 0706), Santa Monica, California, 90404, United States|University of Colorado Cancer Center ( Site 0708), Aurora, Colorado, 80045, United States|Yale Cancer Center ( Site 0709), New Haven, Connecticut, 06510, United States|Baptist MD Anderson Cancer Center ( Site 0767), Jacksonville, Florida, 32207, United States|Mid-Florida Cancer Centers ( Site 0764), Orange City, Florida, 32763, United States|AMG Oncology ( Site 0714), Park Ridge, Illinois, 60068, United States|Illinois Cancer Care, PC ( Site 0765), Peoria, Illinois, 61615, United States|Minnesota Oncology Specialist, PA ( Site 0766), Fridley, Minnesota, 55432, United States|St. Vincent Frontier Cancer Center ( Site 0724), Billings, Montana, 59102, United States|Atlantic Health System ( Site 0768), Morristown, New Jersey, 07960, United States|Valley Hospital ( Site 0749), Paramus, New Jersey, 07652, United States|University of North Carolina - Cancer Hospital ( Site 0751), Chapel Hill, North Carolina, 27514, United States|OHSU Center for Health & Healing ( Site 0731), Portland, Oregon, 97239, United States|Inova Schar Cancer Institute ( Site 0739), Fairfax, Virginia, 22031-4867, United States|Lismore Base Hospital ( Site 0453), Lismore, Australian Capital Territory, 2480, Australia|Melanoma Institute Australia ( Site 0452), North Sydney, New South Wales, 2060, Australia|Westmead Hospital ( Site 0451), Westmead, New South Wales, 2145, Australia|Princess Alexandra Hospital ( Site 0454), Wooloongabba, Queensland, 4102, Australia|Eastern Health ( Site 0457), Box Hill, Victoria, 3128, Australia|Fiona Stanley Hospital ( Site 0456), Murdoch, Western Australia, 6150, Australia|LKH Universitatsklinikum Graz ( Site 0776), Graz, Steiermark, 8036, Austria|Medizinische Universitat Wien ( Site 0778), Wien, 1090, Austria|PERSONAL - Oncologia de Precisao e Personalizada ( Site 0399), Belo Horizonte, Minas Gerais, 30130-090, Brazil|Hospital de Caridade de Ijui ( Site 0391), Ijui, Rio Grande Do Sul, 98700-000, Brazil|Hospital Sao Vicente de Paulo ( Site 0396), Passo Fundo, Rio Grande Do Sul, 99010-080, Brazil|Uniao Brasileira de Educacao e Assistencia Hospital Sao Lucas da Pucrs ( Site 0397), Porto Alegre, Rio Grande Do Sul, 90610-000, Brazil|Instituto Nacional de Cancer Hospital do Cancer II ( Site 0394), Rio de Janeiro, 20220-410, Brazil|BC Cancer-Kelowna - Sindi Ahluwalia Hawkins Centre ( Site 0661), Kelowna, British Columbia, V1Y 5L3, Canada|Lions Gate Hospital ( Site 0662), North Vancouver, British Columbia, V7L 2L7, Canada|Sunnybrook Research Institute ( Site 0654), Toronto, Ontario, M4N 3M5, Canada|Centre Hospitalier de l Universite de Montreal - CHUM ( Site 0652), Montreal, Quebec, H2W 3E4, Canada|McGill University Health Centre ( Site 0651), Montreal, Quebec, H4A 3J1, Canada|Centro Investigación del Cáncer James Lind ( Site 0425), Temuco, Araucania, 4780000, Chile|Fundacion Arturo Lopez Perez FALP ( Site 0421), Santiago, Region M. De Santiago, 7500921, Chile|Pontificia Universidad Catolica de Chile ( Site 0422), Santiago, Region M. De Santiago, 8330024, Chile|Sociedad Medica Aren y Bachero Limitada ( Site 0426), Santiago, Region M. De Santiago, 8420383, Chile|Oncocentro ( Site 0424), Vina del Mar, Valparaiso, 2520598, Chile|Beijing Cancer Hospital ( Site 0601), Beijing, Beijing, 100036, China|Fujian Provincial Cancer Hospital ( Site 0612), Fuzhou, Fujian, 350014, China|Sun Yat-Sen University Cancer Center ( Site 0602), Guangzhou, Guangdong, 510000, China|Henan Cancer Hospital ( Site 0610), Zhengzhou, Henan, 450003, China|Nanjing Drum Tower Hospital ( Site 0609), Nanjing, Jiangsu, 210008, China|The First Hospital Of Jilin University ( Site 0603), Chang Chun, Jilin, 130021, China|Fudan University Shanghai Cancer Center ( Site 0607), Shanghai, Shanghai, 200032, China|Tianjin Medical University Cancer Institute & Hospital ( Site 0606), Tianjin, Tianjin, 300060, China|Yunnan Cancer Hospital ( Site 0604), Kunming, Yunnan, 430030, China|Sir Run Run Shaw Hospital ( Site 0605), Hangzhou, Zhejiang, 310018, China|Zhejiang Cancer Hospital ( Site 0608), Hangzhou, Zhejiang, 310022, China|Hopital ARCHET 2 ( Site 0009), Nice, Alpes-Maritimes, 06200, France|Hopital La Timone ( Site 0002), Marseille, Bouches-du-Rhone, 13385, France|CHU Dijon Bourgogne ( Site 0010), Dijon, Cote-d Or, 21079, France|Institut Claudius Regaud IUCT Oncopole ( Site 0003), Toulouse, Haute-Garonne, 31059, France|Hopital Ambroise Pare Boulogne ( Site 0007), Boulogne-Billancourt, Hauts-de-Seine, 92100, France|CHRU Lille - Hopital Claude Huriez ( Site 0004), Lille, Nord, 59037, France|CHU de Rouen ( Site 0013), Rouen, Seine-Maritime, 76000, France|Centre Hospitalier Victor Dupouy ( Site 0012), Argenteuil, Val-d Oise, 95100, France|Institut Gustave Roussy ( Site 0001), Villejuif, Val-de-Marne, 94805, France|CHU de la Miletrie Poitiers ( Site 0011), Poitiers, Vienne, 86021, France|Klinik fur Dermatologie Allergologie und Venerologie ( Site 0035), Hannover, Baden-Wurttemberg, 30625, Germany|Universitaetsklinikum Erlangen ( Site 0044), Erlangen, Bayern, 91054, Germany|Universitaetsklinikum Wuerzburg-Department of Dermatology ( Site 0036), Wuerzburg, Bayern, 97080, Germany|Hautkrebszentrum Buxtehude ( Site 0037), Buxtehude, Niedersachsen, 21614, Germany|Universitaetsklinikum Carl Gustav Carus ( Site 0041), Dresden, Sachsen, 01307, Germany|Universitaetsklinikum Leipzig ( Site 0040), Leipzig, Sachsen, 04103, Germany|Universitaetsklinikum Schleswig-Holstein Campus Kiel ( Site 0033), Kiel, Schleswig-Holstein, 24105, Germany|SRH Wald-Klinikum Gera GmbH ( Site 0042), Gera, Thuringen, 07548, Germany|HaEmek Medical Center ( Site 0306), Afula, 1834111, Israel|Soroka Medical Center ( Site 0303), Beer Sheva, 8457108, Israel|Rambam Medical Center ( Site 0301), Haifa, 3109601, Israel|Hadassah Ein Karem Hebrew University Medical Center ( Site 0305), Jerusalem, 9112001, Israel|Rabin Medical Center ( Site 0302), Petah Tikva, 4941492, Israel|Chaim Sheba Medical Center ( Site 0304), Ramat Gan, 5262000, Israel|Sourasky Medical Center ( Site 0307), Tel Aviv, 6423906, Israel|Shamir Medical Center-Assaf Harofeh ( Site 0308), Zerifin, 70300, Israel|ASST Papa Giovanni XXIII ( Site 0062), Bergamo, Abruzzo, 24127, Italy|Azienda Ospedaliera Universitaria Senese ( Site 0065), Siena, Toscana, 53100, Italy|Fondazione IRCCS Istituto Nazionale dei Tumori di Milano ( Site 0064), Milano, 20133, Italy|Istituto Europeo di Oncologia ( Site 0067), Milano, 20141, Italy|Istituto Nazionale Tumori Fondazione Pascale ( Site 0061), Napoli, 80131, Italy|Istituto Oncologico Veneto ( Site 0063), Padova, 35128, Italy|Kyungpook National University Chilgok Hospital ( Site 0553), Daegu, Taegu-Kwangyokshi, 41404, Korea, Republic of|Seoul National University Hospital ( Site 0554), Seoul, 03080, Korea, Republic of|Severance Hospital Yonsei University Health System ( Site 0552), Seoul, 03722, Korea, Republic of|Samsung Medical Center ( Site 0551), Seoul, 06351, Korea, Republic of|Centrum Onkologii im.prof. F. Lukaszczyka w Bydgoszczy ( Site 0273), Bydgoszcz, Kujawsko-pomorskie, 85-796, Poland|Pratia MCM Krakow ( Site 0280), Krakow, Malopolskie, 30-510, Poland|Uniwersyteckie Centrum Kliniczne ( Site 0281), Gdansk, Pomorskie, 80-214, Poland|Narodowy Instytut Onkologii - Oddzial w Gliwicach ( Site 0278), Gliwice, Slaskie, 44-102, Poland|Szpital Kliniczny im. Heliodora Swiecickiego Uniwers Medyczn ( Site 0272), Poznan, Wielkopolskie, 60-780, Poland|Cancer Care Langenhoven Drive Oncology Centre ( Site 0805), Port Elizabeth, Eastern Cape, 6045, South Africa|Sandton Oncology Medical Group PTY LTD ( Site 0802), Johannesburg, Gauteng, 2196, South Africa|Cape Town Oncology Trials Pty Ltd ( Site 0803), Kraaifontein, Western Cape, 7570, South Africa|Hospital Duran i Reinals ICO de Hospitalet ( Site 0187), Hospitalet del Llobregat, Barcelona, 08908, Spain|Hospital Universitario Marques de Valdecilla ( Site 0181), Santander, Cantabria, 39008, Spain|Complejo Hospitalario Universitario A Coruna. CHUAC ( Site 0182), A Coruna, La Coruna, 15006, Spain|Hospital Universitario Insular de Gran Canaria ( Site 0189), Las Palmas de Gran Canaria, Las Palmas, 35001, Spain|Hospital Clinic i Provincial Barcelona ( Site 0190), Barcelona, 08036, Spain|Hospital General Universitario Gregorio Maranon ( Site 0191), Madrid, 28009, Spain|Hospital Universitario Ramon y Cajal ( Site 0183), Madrid, 28034, Spain|Hospital Universitario La Paz ( Site 0184), Madrid, 28046, Spain|Hospital Universitario Carlos Haya ( Site 0186), Malaga, 29010, Spain|Laenssjukhuset Ryhov ( Site 0215), Jonkoping, Jonkopings Lan, 551 85, Sweden|Centrallasarettet Vaxjo ( Site 0214), Vaxjo, Kronobergs Lan, 351 85, Sweden|Skanes Universitetssjukhus ( Site 0213), Lund, Skane Lan, 221 85, Sweden|Karolinska Universitetssjukhuset ( Site 0211), Solna, Stockholms Lan, 171 64, Sweden|Akademiska Sjukhuset ( Site 0218), Uppsala, Uppsala Lan, 751 85, Sweden|Norrlands Universitetssjukhus ( Site 0216), Umea, Vasterbottens Lan, 901 85, Sweden|Sahlgrenska Universitetssjukhuset ( Site 0212), Goteborg, Vastra Gotalands Lan, 413 45, Sweden|Universitaetsspital Basel ( Site 0094), Basel, Basel-Stadt, 4031, Switzerland|Kantonsspital Graubuenden ( Site 0091), Chur, Grisons, 7000, Switzerland|Kantonsspital Winterthur ( Site 0095), Winterthur, Zurich, 8401, Switzerland|Universitaetsspital Zuerich ( Site 0092), Zuerich-Flughafen, Zurich, 8058, Switzerland|Western General Hospital ( Site 0121), Edinburgh, Edinburgh, City Of, EH4 2XU, United Kingdom|Guys and St Thomas NHS Foundation Trust ( Site 0126), London, London, City Of, SE1 9RT, United Kingdom|Derriford Hospital ( Site 0129), Plymouth, PL6 8DH, United Kingdom|Singleton Hospital ( Site 0131), Swansea, SA2 8QA, United Kingdom"
NCT00060710,CP-461 in the Treatment of Patients With Advanced Melanoma,https://clinicaltrials.gov/study/NCT00060710,NO,Malignant Melanoma,DRUG: CP-461,ALL,"ADULT, OLDER_ADULT",PHASE2,"Columbia Presbyterian Medical Center, New York, New York, 10032, United States"
