NCT Number,Study Title,Study URL,Study Results,Conditions,Interventions,Sex,Age,Phases,Locations
NCT01704287,Study of Pembrolizumab (MK-3475) Versus Chemotherapy in Participants With Advanced Melanoma (MK-3475-002/P08719/KEYNOTE-002),https://clinicaltrials.gov/study/NCT01704287,YES,Malignant Melanoma,BIOLOGICAL: Pembrolizumab|DRUG: Carboplatin|DRUG: Paclitaxel|DRUG: Dacarbazine|DRUG: Temozolomide,ALL,"ADULT, OLDER_ADULT",PHASE2,
NCT01248936,A Study of RO5185426 in Patients With Metastatic Melanoma,https://clinicaltrials.gov/study/NCT01248936,YES,Malignant Melanoma,DRUG: RO5185426,ALL,"CHILD, ADULT, OLDER_ADULT",PHASE2,"Tucson, Arizona, 85724-5078, United States|Los Angeles, California, 90095, United States|San Francisco, California, 94115, United States|San Francisco, California, 94117, United States|Santa Monica, California, 90025, United States|Aurora, Colorado, 80045, United States|New Haven, Connecticut, 06520-8063, United States|Palm Harbor, Florida, 34684, United States|Tampa, Florida, 33612-9497, United States|Atlanta, Georgia, 30322, United States|Park Ridge, Illinois, 60068, United States|Boston, Massachusetts, 02114, United States|Boston, Massachusetts, 02215, United States|Detroit, Michigan, 48201, United States|St. Louis, Missouri, 63110, United States|New York, New York, 10016, United States|New York, New York, 10029, United States|New York, New York, 10032, United States|New York, New York, 10065, United States|Cincinnati, Ohio, 45242, United States|Oklahoma City, Oklahoma, 73104, United States|Portland, Oregon, 97225, United States|Philadelphia, Pennsylvania, 19104, United States|Columbia, South Carolina, 29210, United States|Nashville, Tennessee, 37203, United States|Dallas, Texas, 75246, United States|Richmond, Virginia, 23230, United States|Seattle, Washington, 98195, United States"
NCT02186249,Expanded Access Program With Nivolumab in Combination With Ipilimumab in Patients With Tumors Unable to be Removed by Surgery or Metastatic Melanoma,https://clinicaltrials.gov/study/NCT02186249,NO,Malignant Melanoma,DRUG: Nivolumab|DRUG: Ipilimumab,ALL,"ADULT, OLDER_ADULT",,"Banner MD Anderson Cancer Center, Gilbert, Arizona, 85234, United States|Mayo Clinic Arizona, Phoenix, Arizona, 85054, United States|6501 Truxtun Avenue, Bakersfield, California, 93309, United States|UC San Diego Moores Cancer Center, La Jolla, California, 92093, United States|100 UCLA Medical Plaza, Los Angeles, California, 90095, United States|514 North Prospect Ave, Redondo Beach, California, 90277, United States|California Pacific Medical Center Research Institute, San Francisco, California, 94115, United States|University of California San Francisco, San Francisco, California, 94115, United States|Angeles Clinic and Research Institute, Santa Monica, California, 90404, United States|1325 East Church Street, Santa Monica, California, 93454, United States|University of Colorado Hospital, Aurora, Colorado, 80045, United States|Rocky Mountain Cancer Centers, Littleton, Colorado, 80120, United States|Smilow Cancer Hospital at Yale University Cancer Center, New Haven, Connecticut, 06519, United States|Georgetown-Lombardi Comprehensive Cancer Center, Washington, District of Columbia, 20007, United States|Memorial Regional Hospital, Hollywood, Florida, 33021, United States|4500 San Pablo Road South, Jacksonville, Florida, 32224, United States|Cancer Specialists of North Florida, Jacksonville, Florida, 32256, United States|UF Health Cancer Center at Orlando Health, Longwood, Florida, 32750, United States|Mount Sinai Medical Center, Miami Beach, Florida, 33140, United States|Florida Hospital Cancer Institute, Orlando, Florida, 32804, United States|H. Lee Moffitt Cancer Center & Research Institute, Tampa, Florida, 33612, United States|Winship Cancer Institute, Atlanta, Georgia, 30322, United States|600 Celebrate Life Parkway, Newnan, Georgia, 30265, United States|Evanston Premier Healthcare Research LLC, Evanston, Illinois, 60201, United States|Oncology Specialists, SC, Niles, Illinois, 60714, United States|Local Institution, Louisville, Kentucky, 40202, United States|Medstar Health Research Institute, Baltimore, Maryland, 21204, United States|Johns Hopkins Sidney Kimmel Comprehensive Cancer Center, Baltimore, Maryland, 21231, United States|Center For Cancer and Blood Disorders, Bethesda, Maryland, 20817, United States|Massachusetts General Hospital, Boston, Massachusetts, 02214, United States|Beth Israel Deaconess Medical Center, Boston, Massachusetts, 02215, United States|Dana Farber Cancer Institute, Boston, Massachusetts, 02215, United States|University of Michigan Comprehensive Cancer Center, Ann Arbor, Michigan, 48109, United States|Karmanos Cancer Institute, Detroit, Michigan, 48201, United States|Cancer and Hematology Centers of Western Michigan, Grand Rapids, Michigan, 49503, United States|Mayo Clinic, Rochester, Minnesota, 55905, United States|Washington University School of Medicine, Saint Louis, Missouri, 63110, United States|Comprehensive Cancer Centers of Nevada, Las Vegas, Nevada, 89148, United States|Atlantic Health System, Morristown, New Jersey, 07960-1089, United States|NYU Langone Medical Center, New York, New York, 10016, United States|Memorial Sloan-Kettering Cancer Center, New York, New York, 10017, United States|Carolinas Healthcare System, Charlotte, North Carolina, 28204, United States|Tulsa Cancer Institute PLLC, Tulsa, Oklahoma, 74146, United States|Northwest Cancer Specialists PC, Portland, Oregon, 97213, United States|Lehigh Valley Health Network, Allentown, Pennsylvania, 18103, United States|St Luke's Hospital, Bethlehem, Pennsylvania, 18015, United States|Greenville Health System, Easley, South Carolina, 29640, United States|Tennessee Oncology PLLC, Nashville, Tennessee, 37203, United States|Texas Oncology, Austin, Texas, 78731, United States|MD Anderson Cancer Center, Houston, Texas, 77030, United States|Texas Oncology, Midland, Texas, 79701, United States|Texas Oncology, Paris, Texas, 75460, United States|Virginia Cancer Institute, Richmond, Virginia, 23230, United States|Oncology and Hematology Associates of Southwest Virginia, Inc, Roanoke, Virginia, 24014, United States|Shenandoah Oncology Association, Winchester, Virginia, 22601, United States|Seattle Cancer Care Alliance, Seattle, Washington, 98109, United States|University of Wisconsin, Madison, Wisconsin, 53792, United States|Cross Cancer Institute, Edmonton, Alberta, T6G 1Z2, Canada|British Columbia Cancer Agency, Vancouver, British Columbia, V5Z 4E6, Canada|Grand River Hospital, Kitchener, Ontario, N2G 1G3, Canada|London Health Sciences Centre, London, Ontario, N6A 4L6, Canada|Lakeridge Health Oshawa, Oshawa, Ontario, L1G 2B9, Canada|Sunnybrook Health Science Centre, Toronto, Ontario, M4N 3M5, Canada|Princess Margaret Hospital, Toronto, Ontario, M5G 2M9, Canada|McGill University Health Center, Montreal, Quebec, H4A 3J1, Canada|Chuq Centre Hospitalier Universitaire de Quebec, Quebec, G1R 2J6, Canada"
NCT00370136,Sentinel Node With Ultrasound Contrast in Melanoma,https://clinicaltrials.gov/study/NCT00370136,NO,Malignant Melanoma,DRUG: ultrasound contrast,ALL,"ADULT, OLDER_ADULT",NA,"Copenhagen univercity hospital, Department of Radiology, section of ultrasound, Copenhagen, 2100, Denmark"
NCT01522664,A Study of DEDN6526A in Patients With Metastatic or Unresectable Melanoma,https://clinicaltrials.gov/study/NCT01522664,NO,Malignant Melanoma,DRUG: DEDN6526A,ALL,"ADULT, OLDER_ADULT",PHASE1,"Los Angeles, California, 90025, United States|Sarasota, Florida, 34232, United States|Detroit, Michigan, 48201, United States|Nashville, Tennessee, 37203, United States|Camperdown, New South Wales, 2050, Australia|East Melbourne, Victoria, 3002, Australia"
NCT01511913,"A Multi-National, Prospective, Observational Study in Patients With Unresectable or Metastatic Melanoma",https://clinicaltrials.gov/study/NCT01511913,NO,Advanced Cutaneous Melanoma,,ALL,"ADULT, OLDER_ADULT",,"Local Institution, Gilbert, Arizona, 85234, United States|Local Institution, Hot Springs, Arkansas, 71913, United States|Local Institution, Encinitas, California, 92024, United States|Local Institution, La Jolla, California, 92093, United States|Local Institution, Long Beach, California, 90813, United States|Local Institution, Los Angeles, California, 90025, United States|Local Institution, Denver, Colorado, 80218, United States|Local Institution, Washington, District of Columbia, 20010, United States|Local Institution, Lakeland, Florida, 33085, United States|Local Institution, Miami Beach, Florida, 33140, United States|Local Institution, Orange Park, Florida, 32073, United States|Local Institution, Chicago, Illinois, 60612, United States|Local Institution, Niles, Illinois, 60714, United States|Local Institution, Detroit, Michigan, 48201, United States|Local Institution, Hattiesburg, Mississippi, 39401, United States|Local Institution, Lincoln, Nebraska, 18015, United States|Local Institution, Morristown, New Jersey, 07960, United States|Local Institution, Canton, Ohio, 44178, United States|Mid Ohio Onc/Hem, Inc, Columbus, Ohio, 43206, United States|Local Institution, Columbus, Ohio, 43219, United States|Local Institution, Middletown, Ohio, 45042, United States|Local Institution, Portland, Oregon, 97213, United States|Local Institution, Knoxville, Tennessee, 37920, United States|Local Institution, Everett, Washington, 98201, United States|Local Institution, Caba, 1426, Argentina|Local Institution, Caba, C1417DNT, Argentina|Local Institution, Caba, C1426ANZ, Argentina|Local Institution, Cordoba, X5006HBF, Argentina|Local Institution, Rosario- Santa Fe, S2000KZE, Argentina|Local Institution, Tucuman, T4000GTB, Argentina|Local Institution, Canberra, Australian Capital Territory, 02605, Australia|Local Institution, Corrimal, New South Wales, 02518, Australia|Local Institution, Lismore, New South Wales, 02480, Australia|Local Institution, Port Macquarie, New South Wales, 02444, Australia|Local Institution, Tamworth, New South Wales, 02340, Australia|Local Institution, Tweeds Head, New South Wales, 02485, Australia|Local Institution, Wagga Wagga, New South Wales, 2650, Australia|Local Institution, Waratah, New South Wales, 02298, Australia|Local Institution, Cairns, Queensland, 4870, Australia|Local Institution, Douglas, Queensland, 04810, Australia|Local Institution, Greenslopes, Queensland, 4120, Australia|Local Institution, Adelaide, South Australia, 05000, Australia|Local Institution, Bedford Park, South Australia, 05042, Australia|Local Institution, Kurralta Park, South Australia, 5037, Australia|Local Institution, Frankston, Victoria, 03199, Australia|Local Institution, Malvern, Victoria, 03144, Australia|Local Institution, Feldkirch, 6800, Austria|Local Institution, Graz, A-8036, Austria|Local Institution, Linz, A-4020, Austria|Local Institution, Salzburg, A-5020, Austria|Local Institution, St Poelten, A-3100, Austria|Local Institution, Vienna, A-1090, Austria|Local Institution, Brasschaat, 2930, Belgium|Local Institution, Brussels, 1200, Belgium|Local Institution, Edegem, 2650, Belgium|Local Institution, Haint Saint Paul, 7100, Belgium|Local Institution, Hasselt, 3500, Belgium|Local Institution, Kortrijk, 8500, Belgium|Local Institution, Leuven, 3000, Belgium|Local Institution, Moncton, New Brunswick, E1C 6Z8, Canada|Local Institution, London, Ontario, N6C 6B5, Canada|Local Institution, Mississauga, Ontario, L5M 2N1, Canada|Local Institution, Windsor, Ontario, N8W 2X3, Canada|Local Institution, Saskatoon, Saskatchewan, S7N 4H4, Canada|Local Institution, Quebec, G1V 4G2, Canada|Local Institution, Québec, G1R 2J6, Canada|Local Institution, Bayonne, 64100, France|Local Institution, Besancon, 25000, France|Local Institution, Boulogne sur Mer, 62200, France|Local Institution, Boulogne, 92104, France|Local Institution, Brest Cedex, 29609, France|Local Institution, Clermont Ferrand Cédex 1, 63003, France|Local Institution, Dijon, 21079, France|Local Institution, Grenoble Cédex, 38043, France|Local Institution, Lille Cedex, 59037, France|Local Institution, Limoges Cedex, 87042, France|Local Institution, Montauban, 82000, France|Local Institution, Mougins, 06250, France|Local Institution, Nouvelle Caledonie, 98849, France|Local Institution, Paris Cedex 10, 75475, France|Local Institution, Pierre Bénite, 69495, France|Local Institution, Quimper Cedex, 29107, France|Local Institution, Quimper, 29107, France|Local Institution, Soissons cedex, 02209, France|Local Institution, Strasbourg Cedex, 67065, France|Local Institution, Vandoeuvre Les Nancy, 54500, France|Local Institution, Augsburg, 86156, Germany|Local Institution, Bochum, 44791, Germany|Local Institution, Buxtehude, 21614, Germany|Local Institution, Chemnitz, 09117, Germany|Local Institution, Darmstadt, 64297, Germany|Local Institution, Dessau-Roblau, 06847, Germany|Local Institution, Dortmund, 44137, Germany|Local Institution, Dresden, 01307, Germany|Local Institution, Düsseldorf, 40225, Germany|Local Institution, Frankfurt, 60590, Germany|Local Institution, Gera, 07548, Germany|Local Institution, Halle/Saale, 06120, Germany|Local Institution, Hamburg, 20099, Germany|Local Institution, Hamburg, 20246, Germany|Local Institution, Hamburg, 20253, Germany|Local Institution, Hannover, 30625, Germany|Local Institution, Jena, 07743, Germany|Local Institution, Koblenz, 56068, Germany|Local Institution, Lüdenscheid, 58515, Germany|Local Institution, Magdeburg, 39120, Germany|Local Institution, Mainz, 55131, Germany|Local Institution, Mannheim, 68167, Germany|Local Institution, Marburg, 35043, Germany|Local Institution, Münster, 48149, Germany|Local Institution, Plauen, 08529, Germany|Local Institution, Quedlinburg, 06484, Germany|Local Institution, Recklinghausen, 45657, Germany|Local Institution, Rostock, 18055, Germany|Local Institution, Schwäbisch Hall, 74523, Germany|Local Institution, Stuttgart, 70374, Germany|Local Institution, Tübingen, 72076, Germany|Local Institution, Würzburg, 97080, Germany|Local Institution, Cholargos, Athens, 15562, Greece|Local institution, Goudi, Athens, 11527, Greece|Local Institution, Neo Faliro, Athens, 18547, Greece|Local Institution, Heraklion, Crete, 71100, Greece|Local Institution, Neas Efkarpia, Thessaloniki, 56429, Greece|Local Institutio, Alexandroupolis, 68100, Greece|Local Institution, Athens, 11528, Greece|Local Institution, Athens, 15233, Greece|Local Institution, Mezourlo, 41334, Greece|Local Institution, Neo Faliro, 18547, Greece|Local Institution, Wilton, Cork, T12 DC4A, Ireland|Local Institution, Cork, Ireland|Local Institution, Dublin, Ireland|Local Institution, Galway, Ireland|Local Institution, Tullamore, Ireland|Local Institution, Haifa, 31096, Israel|Local Institution, Tel Aviv, 64239, Israel|Local Institution, Tel Hashomer, 52621, Israel|Local Institution, Bydgoszcz, 85-796, Poland|Local Institution, Warszawa, 02-781, Poland|Local Institution, Wrocław, 51-124, Poland|Local Institution, Łódź, 93-510, Poland|Local Institution, Barcelona, 08036, Spain|Local Institution, Donostia, 20014, Spain|Local Institution, Las Palmas de Gran Canaria, 35016, Spain|Local Institution, Madrid, 28007, Spain|Local Institution, Madrid, 28033, Spain|Local Institution, Madrid, 28034, Spain|Local Institution, Madrid, 28041, Spain|Local Institution, Palma de Mallorca, 07198, Spain|Local Institution, Palma, 07198, Spain|Local Institution, Pamplona, 31008, Spain|Local Institution, Santa Cruz de Tenerife, 38010, Spain|Local Institution, Santander, 39008, Spain|Local Institution, Santiago De Compostela; A Coruña, 15706, Spain|Local Institution, Sevilla, 41013, Spain|Local Institution, Sta Cruz de Tenerife, 35320, Spain|Local Institution, Terrassa, 08027, Spain|Local Institution, Valladolid, 47012, Spain|Local Institution, Zaragoza, 50009, Spain|Local Institution, Baden, CH-5404, Switzerland|Local Institution, Lugano, CH-6900, Switzerland|Local Institution, Zurich, 8091, Switzerland|Local Institution, Zürich, CH-8091, Switzerland|Local Institution, Rhyl, Denbigshire, LL18 5UJ, United Kingdom|Local Institution, London, England, NW3 2QG, United Kingdom|Local Institution, Chelmsford, Essex, Essex, CM1 7ET, United Kingdom|Local Institution, Southend, Essex, SS0 0RY, United Kingdom|Local Institution, Belfast, Ireland, BT9 7AB, United Kingdom|Local Institution, Cardiff, South Glamorgan, CF14 2TL, United Kingdom|Local Institution, Birmingham, B15 2TH, United Kingdom|Local Institution, Bristol, BS2 8ED, United Kingdom|Local Institution, Exeter, EX2 5DW, United Kingdom|Local Institution, Hull, HU16 5JQ, United Kingdom|Local Institution, Leeds, LS9 7TF, United Kingdom|Local Institution, Lincoln, LN2 5QY, United Kingdom|Local Institution, London, SE1 9RT, United Kingdom|Local Institution, London, SW3 6JJ, United Kingdom|Local Institution, London, United Kingdom|Local Institution, Oxfordshire, OX3 7LE, United Kingdom|Local Institution, Plymouth, PL6 8DH, United Kingdom|Local Institution, Poole, BH15 2JB, United Kingdom|Local Institution, Preston, PR2 9HT, United Kingdom|Local Institution, Staffordshire, ST46QG, United Kingdom|Local Institution, Taunton, Somerset, TA1 5DA, United Kingdom|Local Institution, Truro, Cornwall, TR1 3LJ, United Kingdom|Local Institution, Wirral, CH63 4JY, United Kingdom|Local Institution, Wolverhampton, WS13 6NH, United Kingdom|Local Institution, Yeovil, Somerset, BA21 4AT, United Kingdom"
NCT01990248,An Observational Safety Study in Zelboraf (Vemurafenib)-Treated Patients With BRAF-V600 Mutation-Positive Unresectable or Metastatic Melanoma (ZeSS),https://clinicaltrials.gov/study/NCT01990248,NO,Malignant Melanoma,,ALL,"ADULT, OLDER_ADULT",,"LKH Feldkirch; Onkologie, Feldkirch, 6800, Austria|Ordensklinikum Linz Elisabethinen ; Dermatologie, Linz, 4020, Austria|Krankenhaus Hietzing Wien, Wien, 1130, Austria|ZNA Middelheim, Antwerpen, 2020, Belgium|CHIREC Edith Cavell, Bruxelles, 1180, Belgium|Cliniques Universitaires St-Luc, Bruxelles, 1200, Belgium|UZ Antwerpen, Edegem, 2650, Belgium|FN Ostrava; Dermatology dep, Ostrava, 708 52, Czechia|University Hospital Prague, Praha, 150 06, Czechia|Komplexni onkologicke centrum Krajske nemocnice T. Bati, a.s. Zlin, Zlin, 760 01, Czechia|Klinikum Augsburg; Hauttumorzentrum, Augsburg, 86179, Germany|Charite- universitatsmedizin Berlin; Med. Klinik mit Schwerpunkt Hamatologie und Onkologie, Berlin, 12200, Germany|Ruhr-Universität Bochum; Klinik für Dermatologie und Allergologie, Bochum, 44791, Germany|Universitatsklinikum Bonn; Klinisches Studienzentrum Klinik fur Dermatologie, Bonn, 53105, Germany|Medizinisches Zentrum, Bonn, 53111, Germany|Dermatologisches Zentrum am Elbe Klinikum Buxtehude, Buxtehude, 21614, Germany|DRK Krankenhaus Chemnitz-Rabenstein; Hautkrebszentrum Chemnitz, Chemnitz, 09117, Germany|Universitätsklinikum ""Carl Gustav Carus""; Klinik und Poliklinik fur Dermatologie, Dresden, 01307, Germany|Universitätsklinikum Düsseldorf; Hautklinik, Düsseldorf, 40225, Germany|Dermatologie und Allergologie HELIOS Hauttumorzentrum Erfurt, Erfurt, 99089, Germany|Universitatsklinikum Essen; Klinik für Dermatologie, Essen, 45147, Germany|SRH Wald-Klinikum Gera; Zentrum fur klinische Studien (ZKS), Gera, 07548, Germany|Universitätsmedizin Greifswald; Klinik und Poliklinik für Hautkrankheiten, Greifswald, 17487, Germany|Universitaetsmedizin Goettingen; Abteilung Dermato-Onkologie, Göttingen, 37075, Germany|Univ.- Hautklinik Heidelberg, Heidelberg, 69115, Germany|Friedrich-Schiller-Universitaet Jena; Klinik fuer Dermatologie und dermatologische Allergologie, Jena, 07743, Germany|Klinikum Kassel GmbH; Hauttumorzentrum HTZ, Kassel, 34125, Germany|Studienzentrum UnterEms; Onkologische Schwerpunktpraxis Leer; Dr. med. Lothar Müller, Leer, 26789, Germany|Klinikum der Stadt Ludwigshafen am Rhein gGmbH; Hauttumorzentrum Rheinpfalz, Ludwigshafen, 67063, Germany|UKSH Universitatsklinikum Schleswig-Holstein; Studienzentrum Dermatologie 10d, Lübeck, 23538, Germany|Klinik und Poliklinik fur Dermatologie; Universitatsklinikum Mainz, Mainz, 55131, Germany|Med. Fakultat Mannheim der Universitat Heidelberg; Klinik fur Dermatologie, Mannheim, 68167, Germany|Johannes Wesling Klinikum Minden;Haut Tumor Centrum Minden, Minden, 32429, Germany|Universitätsklinikum Münster; Klinik für Hautkrankheiten; Allgemeine Dermatologie und Venerologie, Muenster, 48149, Germany|Fachklinik Hornheide; Abteilung für Dermatologie, Muenster, 48157, Germany|Klinikum Nürnberg Nord; Hautklinik; Klinik für Dermatologie, Nürnberg, 90419, Germany|Harzklinikum Dorothea Christiane Erxleben GmbH, Standort Quedlinburg; Hautkrebszentrum Harz, Quedlinburg, 06484, Germany|Klinikum Vest; Behandlungszentrum Kanppschaftskrankenhaus Recklinghausen, Recklinghausen, 45657, Germany|Universitätsmedizin Rostock; Klinik und Poliklinik für Dermatologie und Venerologie, Rostock, 18057, Germany|Eberhard-Karls-Universitat Tubingen; Sektion Dermatologische Onkologie, Tuebingen, 72076, Germany|Universitätsklinikum Würzburg; Klinik und Poliklinik für Dermatologie Venerologie u. Allergologie, Würzburg, 97080, Germany|Galway University Hospital; Clinical Trials Department, Galway, Ireland|Istituto Nazionale Tumori Fondazione G. Pascale, Napoli, Campania, 80131, Italy|Policlinico S. Orsola Malpighi;Dip. Ematologia, Oncologia e Medicina di Laboratorio, Bologna, Emilia-Romagna, 40138, Italy|Ausl Ravenna-Osp.Infermi; Day Hospital Oncologia Medica, Faenza, Emilia-Romagna, 48018, Italy|Universita di Modena e Reggio Emilia;Dipartimento di Oncologia ed Ematologia, Modena, Emilia-Romagna, 41100, Italy|Ospedale ""Guglielmo da Saliceto"";U.O. Medicina Oncologica, Piacenza, Emilia-Romagna, 29121, Italy|Azienda ASL di Rimini (Presidi di Rimini - Cattolica)) - Ospedale degli Infermi;U.O. Oncologia, Rimini, Emilia-Romagna, 47922, Italy|Fondazione IRCCS Istituto Nazionale dei Tumori, Milano, Lombardia, 20133, Italy|Asst Grande Ospedale Metropolitano Niguarda; Dipartimento Di Ematologia Ed Oncologia, Milano, Lombardia, 20162, Italy|Fondazione IRCCS Policlinico San Matteo, Oncologia, Pavia, Lombardia, 27100, Italy|A.O.V.V. - P.O. di Sondrio; S.O.C. Oncologia Medica, Sondrio, Lombardia, 23100, Italy|A.U Careggi di Firenze;Oncologia, Firenze, Toscana, 50134, Italy|Azienda Ospedaliero Universitaria Pisana, Pisa, Toscana, 56100, Italy|Azienda Ospedaliera Universitaria Senese, U.O.C. Immunoterapia Oncologica, Siena, Toscana, 53100, Italy|Amphia Ziekenhuis, locatie Langendijk;Oncology, Breda, 4819 EV, Netherlands|Academ Ziekenhuis Groningen; Medical Oncology, Groningen, 9713 GZ, Netherlands|Atrium MC, Parkstad Heerlen; Poli Interne, Heerlen, 6419 PC, Netherlands|Maastricht University Medical Center,Division of Medical Oncology; Dept. Internal Medicine, Maastricht, 6229 HX, Netherlands|Centrum Onkologii w Bydgoszczy; Oddzial Kliniczny Onkologii, Bydgoszcz, 85-796, Poland|Szpital Uniwersytecki w Krakowie, Oddział Kliniczny Kliniki Onkologii, Krakow, 31-531, Poland|RegioNAlny Osrodek Onkologiczny Pododdział Diagnostyki i Terapii Onkologicznej, Lodz, 93-513, Poland|Regionalny Osrodek Onkologiczny; Oddzial Chorob Rozrostowych, Lodz, 93-513, Poland|Samodzielny Publiczny Zaklad Opieki Zdrowotnej; Opolskie Centrum Onkologii, Opole, 45-060, Poland|Centrum Onkologii - Instytut, Klinika Nowotworow Tkanek Miekkich, Kosci i Czerniakow, Warszawa, 02-781, Poland|Blekingesjukhuset; Kirurgkliniken, Karlskrona, 371 85, Sweden|Karolinska University Hospital;Department of Oncology-Pathology, Stockholm, 17176, Sweden|Royal Sussex County Hospital, Brighton, BN2 5BE, United Kingdom|Bristol Haematology and Oncology Centre, Bristol, BS2 8ED, United Kingdom|Addenbrookes Hospital; Dept of Oncology, Cambridge, CB2 2QQ, United Kingdom|Velindre Cancer Centre, Cardiff, CF14 2TL, United Kingdom|Cheltenham General Hospital; Gloucestershire Oncology Centre, Cheltenham, GL53 7AN, United Kingdom|Dorset County Hospital NHS Foundation Trust;Research and Development/ Oncology, Dorchester, DT1 2JY, United Kingdom|St James University Hospital, Leeds, LS9 7TF, United Kingdom|Guys and St Thomas NHS Foundation Trust, Guys Hospital, London, SE1 9RT, United Kingdom|St George's Hospital; Oncology, London, SW17 0QT, United Kingdom|Imperial College Healthcare NHS Trust;Medical Oncology, London, W6 8RF, United Kingdom|St Helens & Knowsley Trust, St Helens, WA9 3DA, United Kingdom|The Clatterbridge Cancer Ctr For Oncolgy, Wirral, CH63 4JY, United Kingdom|New Cross Hospital; Deansley Centre, Wolverhampton, WV10 0QP, United Kingdom"
NCT01898585,An Open-Label Study of Zelboraf (Vemurafenib) in Patients With Braf V600 Mutation Positive Metastatic Melanoma,https://clinicaltrials.gov/study/NCT01898585,NO,Malignant Melanoma,DRUG: Zelboraf,ALL,"ADULT, OLDER_ADULT",PHASE4,"National Hospital; Oncotherapy Dept, Bloemfontein, 9301, South Africa|Groote Schuur Hospital ( Uni of Capetown ); Oncology Dept, Cape Town, 7506, South Africa|Cape Town Oncology Trials, Cape Town, 7570, South Africa|Cancercare, Cape Town, 7700, South Africa|Cancercare, George, 6529, South Africa|Mary Potter Oncology Centre, Groenkloof, 0181, South Africa|Medical Oncology Centre of Rosebank; Oncology, Johannesburg, 2196, South Africa|University of Pretoria; Department of Medical Oncology, Pretoria, 0002, South Africa|Sandton Oncology Medical Group, Sandton, 2196, South Africa"
NCT01910181,A Study of Vemurafenib (Zelboraf) in Chinese Participants With BRAF V600 Mutation-Positive Unresectable or Metastatic Melanoma,https://clinicaltrials.gov/study/NCT01910181,YES,Malignant Melanoma,DRUG: Vemurafenib,ALL,"ADULT, OLDER_ADULT",PHASE1,"Beijing Cancer Hospital, Beijing, 100142, China|Sun Yet-sen University Cancer Center, Guangzhou, 510060, China"
